"Location ID","Name","Type","Comment","Country","State","County","Latitude","Longitude","Horizontal Datum","Horizontal Collection Method","Vertical Datum","Vertical Collection Method","Location Groups","Elevation","Elevation Unit","Standards","EA_Closed Date","EA_EMS When Created","EA_EMS When Updated","EA_EMS Who Created","EA_EMS Who Updated","EA_Established Date","EA_Well Tag ID"
"E217310","G2","Well","GROUNDWATER WELL","","","","49.146600","-122.5009","","GOAT- orthoimagery (NAD83)","","","10484","","","","","11/1/1996 10:51:59 AM","3/11/1998 6:56:50 PM","Created by  EMS from 20 Lower Mainland, Surrey","Updated by  EMS from 20 Lower Mainland, Surrey","7/30/1992",""
"E217311","G3","Well","GROUNDWATER WELL","","","","49.146400","-122.501","","GOAT- orthoimagery (NAD83)","","","10484","","","","","11/1/1996 10:51:59 AM","3/11/1998 6:56:50 PM","Created by  EMS from 20 Lower Mainland, Surrey","Updated by  EMS from 20 Lower Mainland, Surrey","7/30/1992",""
"E217312","G4","Well","GROUNDWATER WELL","","","","49.146600","-122.5009","","GOAT- orthoimagery (NAD83)","","","10484","","","","","11/1/1996 10:51:59 AM","3/11/1998 6:56:51 PM","Created by  EMS from 20 Lower Mainland, Surrey","Updated by  EMS from 20 Lower Mainland, Surrey","7/30/1992",""
"E217313","G5","Well","GROUNDWATER WELL","","","","49.146400","-122.501","","GOAT- orthoimagery (NAD83)","","","10484","","","","","11/1/1996 10:51:59 AM","3/11/1998 6:57:14 PM","Created by  EMS from 20 Lower Mainland, Surrey","Updated by  EMS from 20 Lower Mainland, Surrey","7/30/1992",""
"E217314","G6","Well","GROUNDWATER WELL","","","","49.146600","-122.5009","","GOAT- orthoimagery (NAD83)","","","10484","","","","","11/1/1996 10:51:59 AM","3/11/1998 6:57:20 PM","Created by  EMS from 20 Lower Mainland, Surrey","Updated by  EMS from 20 Lower Mainland, Surrey","7/30/1992",""
"E217315","G7","Well","GROUNDWATER WELL","","","","49.146400","-122.5009","","GOAT- orthoimagery (NAD83)","","","10484","","","","","11/1/1996 10:51:59 AM","3/11/1998 6:56:51 PM","Created by  EMS from 20 Lower Mainland, Surrey","Updated by  EMS from 20 Lower Mainland, Surrey","7/30/1992",""
"E217321","S1 (PE 10484)","Lake or Pond","SURFACE WATER","","","","49.145800","-122.5003","","GOAT- orthoimagery (NAD83)","","","10484","","","","","11/1/1996 10:51:59 AM","4/29/2005 8:48:00 AM","Created by  EMS from 20 Lower Mainland, Surrey","Updated by Liz Freyman from 20 Lower Mainland, Surrey","7/30/1992",""
"E217322","S2 (PE 10484)","Lake or Pond","SURFACE WATER","","","","49.146300","-122.4999","","GOAT- orthoimagery (NAD83)","","","10484","","","","","11/1/1996 10:51:59 AM","4/29/2005 8:47:33 AM","Created by  EMS from 20 Lower Mainland, Surrey","Updated by Liz Freyman from 20 Lower Mainland, Surrey","7/30/1992",""
"E217323","S3 (PE 10484)","Lake or Pond","SURFACE WATER","","","","49.147400","-122.4974","","GOAT- orthoimagery (NAD83)","","","10484","","","","","11/1/1996 10:51:59 AM","4/29/2005 8:48:25 AM","Created by  EMS from 20 Lower Mainland, Surrey","Updated by Liz Freyman from 20 Lower Mainland, Surrey","7/30/1992",""
"E217325","DISCHARGE TO SLUDGE STORAGE LAGOONS","In-Plant","DISCHARGE POINT","","","","49.223500","-121.7441","","GOAT- orthoimagery (NAD83)","","","137","","","","","11/1/1996 10:52:00 AM","3/11/1998 6:57:15 PM","Created by  EMS from 20 Lower Mainland, Surrey","Updated by  EMS from 20 Lower Mainland, Surrey","7/31/1992",""
"E217360","SEWAGE PRODUCTION; POPULATION BASED","Outfall","This site is used for waste permit fees calculation purposes only. Comments:   site created for fees purposes.  fee based on sewage production.","","","","54.313100","-130.3356","","1:50,000 scale map","","","5577","","","","","11/1/1996 10:52:01 AM","8/15/2000 1:33:07 PM","Created by  EMS from 60 Skeena","Updated by JOHN COLLISON-BAKER from 60 Skeena","9/14/1992",""
"E217399","CITY OF PG- SHELLEY (PE2557) RAW INFLOW","In-Plant","","","","","53.949900","-122.6291","","Geographic Positioning System (NAD83)","","","2557","","","","","11/1/1996 10:52:03 AM","5/10/2005 1:56:41 PM","Created by  EMS from 70 Omineca-Peace, Prince George","Updated by Steve Jenvey from 70 Omineca-Peace, Prince George","8/24/1992",""
"E217405","RDEK (PE-0308) STP SLUDGE BASIN; CANAL FLATS","Seepage or Seepage Pools","LOCATED NEXT TO AERATION LAGOON #1","","","","50.148900","-115.8081","","GOAT- 1:20,000 TRIM (NAD83)","","","308","","","","","11/1/1996 10:52:03 AM","11/10/1999 8:45:48 AM","Created by  EMS from 41 Kootenay, Cranbrook","Updated by William (Hugh) Auld from 41 Kootenay, Cranbrook","2/9/1993",""
"E217406","COMINCO (PS-11532) THALLIUM DICHR. STORAGE DUNCAN FLATS","Storage","","","","","49.111000","-117.7362","","GOAT- 1:20,000 TRIM (NAD83)","","","11532","","","","","11/1/1996 10:52:03 AM","2/10/1998 12:45:50 PM","Created by  EMS from 40 Kootenay, Nelson","Updated by HUGH AULD from 40 Kootenay, Nelson","9/1/1992",""
"E217416","PE-11016; H.A.HOLLAND;EAGLES COVE;JOHNSTONEST","Outfall","","","","","50.246700","-125.395","","Geographic Positioning System (Datum not known)","","","11016","","","","","11/1/1996 10:52:03 AM","6/14/1999 2:26:19 PM","Created by  EMS from 10 Vancouver Island, Nanaimo","Updated by  EMS from 10 Vancouver Island, Nanaimo","9/8/1992",""
"E217427","PA-8212: PLANT BUBBLE EMMISSION","Stack","Overall discharge from gas plant.","","","","56.826222","-122.361778","","1:20,000 scale map (NAD27)","","","8212","","","","","11/1/1996 10:52:03 AM","5/16/2005 11:34:42 AM","Created by  EMS from 70 Omineca-Peace, Prince George","Updated by Steve Jenvey from 70 Omineca-Peace, Prince George","9/11/1992",""
"E217430","PR2608 SANDSPIT TRANSFER STATION REGULATED OPEN BURNING","Stack","","","","","53.238611","-131.808611","","GOAT- 1:20,000 TRIM (NAD83)","","","2608","","","","","11/1/1996 10:52:04 AM","5/6/2005 3:40:47 PM","Created by  EMS from 60 Skeena","Updated by Eric Pierce from 60 Skeena","9/14/1992",""
"E217448","WMS LK; PANORAMA (PE9029) TILE FIELD","Tile Field","","","","","52.112600","-122.1769","","Differential Geographic Positioning System (Datum not known)","","","9029","","","","","11/1/1996 10:52:04 AM","3/21/1997 11:20:55 AM","Created by  EMS from 50 Cariboo, Williams Lake","Updated by  EMS from 50 Cariboo, Williams Lake","9/18/1992",""
"E217484","ALBERTA NATURAL GAS (PA-4331) WELL 3 MOYIE","Well","West NOx source well","","","","49.246000","-115.8461","","GOAT- 1:20,000 TRIM (NAD83)","","","4331","","","","","11/1/1996 10:52:06 AM","12/8/1998 4:10:53 PM","Created by  EMS from 41 Kootenay, Cranbrook","Updated by William (Hugh) Auld from 41 Kootenay, Cranbrook","9/25/1992",""
"E217485","ALBERTA NATURAL GAS (PA-4331) WELL 4 MOYIE","Well","East NOx source well","","","","49.246000","-115.8461","","GOAT- 1:20,000 TRIM (NAD83)","","","4331","","","","","11/1/1996 10:52:06 AM","12/8/1998 4:10:28 PM","Created by  EMS from 41 Kootenay, Cranbrook","Updated by William (Hugh) Auld from 41 Kootenay, Cranbrook","9/25/1992",""
"E217519","SICAMOUS SHAKE (PA-10575) WOOD WASTE BURNER","Stack","Wood Waste Burner","","","","50.865000","-118.9275","","1:50,000 scale map","","","10575","","","","","11/1/1996 10:52:07 AM","3/2/1998 9:54:56 AM","Created by  EMS from 30 Southern Region, Kamloops","Updated by COLLEEN LAVIOLETTE from 30 Southern Region, Kamloops","10/2/1992",""
"E217524","NORTH  OTTER SCHOOL PE-11350 FINAL EFFLUENT","Tile Field","AT FINAL DISCHARGE","","","","49.099900","-122.5354","","GOAT- orthoimagery (NAD83)","","","11350","","","","","11/1/1996 10:52:07 AM","3/11/1998 6:56:51 PM","Created by  EMS from 20 Lower Mainland, Surrey","Updated by  EMS from 20 Lower Mainland, Surrey","10/5/1992",""
"E217526","GOWLLAND HARBOUR","Landfill","REFUSE SITE","","","","50.105000","-125.26","","Geographic Positioning System (Datum not known)","","","10596","","","","","11/1/1996 10:52:07 AM","6/14/1999 2:26:20 PM","Created by  EMS from 10 Vancouver Island, Nanaimo","Updated by  EMS from 10 Vancouver Island, Nanaimo","10/6/1992",""
"E217543","CMH (PE-8486) BUGABOO LODGE STP BLACK WATER","Outfall","30 MILES WEST OF SPILLIMACHEEN VIA FORESTRY ROAD.","","","","50.685800","-116.7461","","GOAT- 1:20,000 TRIM (NAD83)","","","100173","","","","","11/1/1996 10:52:08 AM","10/28/1999 1:48:03 PM","Created by  EMS from 41 Kootenay, Cranbrook","Updated by William (Hugh) Auld from 41 Kootenay, Cranbrook","10/15/1992",""
"E217548","NORDSTROM`S ENTERPRISES LTD. (PE-10869) RECREATION DEV (APP.01) CLEARWATER","Septic Tank","","","","","51.649400","-120.0603","","GOAT- 1:20,000 TRIM (NAD83)","","","10869","","","","","11/1/1996 10:52:08 AM","11/28/1997 8:00:03 AM","Created by  EMS from 30 Southern Region, Kamloops","Updated by COLLEEN LAVIOLETTE from 30 Southern Region, Kamloops","10/16/1992",""
"E217550","SD #57- BUCKHORN (PE5032) - RAW INFLOW","In-Plant","","","","","53.794200","-122.6514","","1:50,000 scale map","","","5032","","","","","11/1/1996 10:52:08 AM","11/5/1997 10:46:58 AM","Created by  EMS from 70 Omineca-Peace, Prince George","Updated by Ben Van Nostrand from 70 Omineca-Peace, Prince George","10/19/1992",""
"E217558","MARTEN`S ASPHALT PA-11210 OIL FIRED HEATER","Stack","AT THE STACK Comments:   FACTORS ARE FROM ENERGY, OIL & GAS REPORT.  THE COMPANY IS CONVERTING FR","","","","49.202300","-121.9479","","GOAT- orthoimagery (NAD83)","","","11210","","","","","11/1/1996 10:52:08 AM","5/21/1998 7:46:56 PM","Created by  EMS from 20 Lower Mainland, Surrey","Updated by  EMS from 20 Lower Mainland, Surrey","10/20/1992",""
"E217559","WEST FRASER MILLS (PA-01691) SAWMILL TIER 1 TEEPEE BURNER","Stack","MAX. DISCHARGE RATE 3780 M3/MIN.  DISCHARGE PERIOD 24 HOURS/DAY.  DISCHARGE FREQUENCY 260 DAYS/YEAR. Comments:   discharge location:  Lot 2, Plan 4196, and part S.W.1/4 section 19, lying north and east of D.L. 5714, township 4, Range 5, Coast Land District","","","","54.759800","-127.1494","","GOAT- 1:20,000 TRIM (NAD83)","","","1691","","","","","11/1/1996 10:52:08 AM","10/10/2000 11:37:53 AM","Created by  EMS from 60 Skeena","Updated by Hoa Le from 60 Skeena","10/20/1992",""
"E217572","COMINCO (PA-2691) TOTAL SULFUR OXIDE EMISSIONS","Stack","","","","","49.100400","-117.7136","","GOAT- 1:20,000 TRIM (NAD83)","","","2691","","","","","11/1/1996 10:52:09 AM","2/4/1998 1:48:37 PM","Created by  EMS from 40 Kootenay, Nelson","Updated by HUGH AULD from 40 Kootenay, Nelson","10/22/1992",""
"E217597","STEWARDSON INLET INTERFOR DRYLAND LOG SORT","Landfill"," Comments:   Legal Description: 1.72 ha located 530 m east, thence 220 m north from the northwest corner post of Lot 665, Clayoquot Land Dist. and unspecified areas approved by the RWM to promote vegetation.","","","","49.423300","-126.3119","","1:50,000 scale map","","","11205","","","","","11/1/1996 10:52:10 AM","6/14/1999 2:26:57 PM","Created by  EMS from 10 Vancouver Island, Nanaimo","Updated by  EMS from 10 Vancouver Island, Nanaimo","10/29/1992",""
"E217598","JACKLAH RIVER CPFP LOG SORT","Landfill"," Comments:   Legal Description: 5 ha located 130 m S and 280 m E of the NW corner of Lot 2, Clayoquot Land District","","","","49.646400","-126.1575","","Geographic Positioning System (Datum not known)","","","11337","","","","","11/1/1996 10:52:10 AM","6/14/1999 2:26:20 PM","Created by  EMS from 10 Vancouver Island, Nanaimo","Updated by  EMS from 10 Vancouver Island, Nanaimo","10/29/1992",""
"E217599","STP FOR SOINTULA ON MALCOLM ISLAND","Outfall","STP sampling point","","","","50.620800","-127.015","","Geographic Positioning System (Datum not known)","","","8372","","","","","11/1/1996 10:52:10 AM","6/14/1999 2:26:21 PM","Created by  EMS from 10 Vancouver Island, Nanaimo","Updated by  EMS from 10 Vancouver Island, Nanaimo","9/27/1994",""
"E217600","EFFLUENT DISCHARGE FROM GOLFCOURSE CLUBHOUSE","Septic Tank"," Comments:   Lots 3,4,5&8, Plan 29282 and Lot 1, Plan 29282 except Plan 43297, Sect ion 9 & 10, Twp 26, ODYD","","","","49.858500","-119.4224","","1:50,000 scale map","","","10885","","","","","11/1/1996 10:52:10 AM","7/17/2001 9:01:17 AM","Created by  EMS from 80 Southern Region, Penticton","Updated by  EMS from 80 Southern Region, Penticton","10/29/1992",""
"E217624","108 MILE;THE HILLS;(PE11011);SEPTIC LAGOONS","Outfall","","","","","51.739200","-121.3235","","Differential Geographic Positioning System (Datum not known)","","","11011","","","","","11/1/1996 10:52:11 AM","3/21/1997 11:20:52 AM","Created by  EMS from 50 Cariboo, Williams Lake","Updated by  EMS from 50 Cariboo, Williams Lake","11/4/1992",""
"E217625","108 MILE;THE HILLS;(PE11011);POOL EXFILT. PIT","Outfall","","","","","51.737400","-121.3248","","Differential Geographic Positioning System (Datum not known)","","","11011","","","","","11/1/1996 10:52:11 AM","3/21/1997 11:20:52 AM","Created by  EMS from 50 Cariboo, Williams Lake","Updated by  EMS from 50 Cariboo, Williams Lake","11/4/1992",""
"E217638","RDKB; ROCK CREEK PE 15327HOLDING/SEPTIC TANK PUMPAGE DRYING BEDS","Seepage or Seepage Pools","RDKB, Rock Creek Holding / Septic Tank Pumpage drying Beds, PE 15327","","","","49.055900","-118.9691","","1:50,000 scale map","","","15327","","","","","11/1/1996 10:52:12 AM","7/17/2001 8:56:13 AM","Created by  EMS from 40 Kootenay, Nelson","Updated by  EMS from 40 Kootenay, Nelson","11/10/1992",""
"E217647","FEDERATED CO-OPERATIVES LTD. (PA-2573)  APPENDIX 03 NG FIRED VENEER DRYERS","Stack","stack","","","","50.748600","-119.2114","","1:50,000 scale map","","","2573","","","","","11/1/1996 10:52:13 AM","2/26/1998 11:37:29 AM","Created by  EMS from 30 Southern Region, Kamloops","Updated by COLLEEN LAVIOLETTE from 30 Southern Region, Kamloops","11/12/1992",""
"E217648","FEDERATED CO-OPERATIVES LTD. (PA-2573)  APPENDIX 04 CHIP TRANSFER SYSTEM","Stack","n\a","","","","50.748600","-119.2114","","1:50,000 scale map","","","2573","","","","","11/1/1996 10:52:13 AM","2/26/1998 11:37:49 AM","Created by  EMS from 30 Southern Region, Kamloops","Updated by COLLEEN LAVIOLETTE from 30 Southern Region, Kamloops","11/12/1992",""
"E217661","RIVERSIDE FOREST PRODUCTS (PE368) TREATED EFFLUENT","Infiltration Pond","Runoff from the hog fuel storage area, boiler blowdown, water softner backwash and 2 domestic septic tanks and described as feed to infiltration basins","","","","50.390400","-119.223","","1:50,000 scale map","","","368","","","","","11/1/1996 10:52:13 AM","10/12/2005 3:34:55 PM","Created by  EMS from 80 Southern Region, Penticton","Updated by Gerri Huggins from 80 Southern Region, Penticton","3/2/1994",""
"E217670","PA8462: POWER GENERATOR","Stack","POWER GENERATOR","","","","56.957778","-121.92","","1:20,000 scale map (NAD27)","","","8462","","","","","11/1/1996 10:52:14 AM","6/13/2005 11:23:45 AM","Created by  EMS from 70 Omineca-Peace, Prince George","Updated by Steve Jenvey from 70 Omineca-Peace, Prince George","11/13/1992",""
"E217676","ELEMENTARY SCHOOL TREATMENT PLANT","Tile Field"," STP and Tile Field","","","","49.179700","-124.0142","","1:50,000 scale map","","","11039","","","","","11/1/1996 10:52:14 AM","6/14/1999 2:27:01 PM","Created by  EMS from 10 Vancouver Island, Nanaimo","Updated by  EMS from 10 Vancouver Island, Nanaimo","11/17/1992",""
"E217695","COMINCO (PA-2692) SULFUR DIOXIDE EMISSIONS","Stack","","","","","49.100900","-117.7177","","GOAT- 1:20,000 TRIM (NAD83)","","","2692","","","","","11/1/1996 10:52:15 AM","2/5/1998 10:50:09 AM","Created by  EMS from 40 Kootenay, Nelson","Updated by HUGH AULD from 40 Kootenay, Nelson","11/19/1992",""
"E217696","PR-1698 GROUNDWATER WELL #1","Well","","","","","49.303700","-123.0171","","Geographic Positioning System (Datum not known)","","","1698","","","","","11/1/1996 10:52:15 AM","4/30/1998 2:28:27 PM","Created by  EMS from 20 Lower Mainland, Surrey","Updated by SUSAN WOODBINE from 20 Lower Mainland, Surrey","11/19/1992",""
"E217697","PR-1698 GROUNDWATER WELL #2","Well","","","","","49.302100","-123.0138","","Geographic Positioning System (Datum not known)","","","1698","","","","","11/1/1996 10:52:15 AM","4/30/1998 2:28:55 PM","Created by  EMS from 20 Lower Mainland, Surrey","Updated by SUSAN WOODBINE from 20 Lower Mainland, Surrey","11/19/1992",""
"E217698","PR-1698 GROUNDWATER WELL #3","Well","","","","","49.300100","-123.0143","","Geographic Positioning System (Datum not known)","","","1698","","","","","11/1/1996 10:52:15 AM","4/30/1998 2:30:05 PM","Created by  EMS from 20 Lower Mainland, Surrey","Updated by SUSAN WOODBINE from 20 Lower Mainland, Surrey","11/19/1992",""
"E217700","LAFARGE STORM WATER DISCHARGE (PE-02439)","Outfall","","","","","49.156900","-123.0079","","GOAT- orthoimagery (NAD83)","","","2439","","","","","11/1/1996 10:52:15 AM","3/11/1998 6:56:54 PM","Created by  EMS from 20 Lower Mainland, Surrey","Updated by  EMS from 20 Lower Mainland, Surrey","11/20/1992",""
"E217706","RDKB; GRAND FORKS PE 15326 HOLDING/SEPTIC TANK PUMPAGE DRYING BEDS","Seepage or Seepage Pools","RDKB, Grand Forks Holding/Septic Tank Pumpage Drying Beds","","","","49.058900","-118.4534","","1:50,000 scale map","","","15326","","","","","11/1/1996 10:52:15 AM","7/17/2001 8:56:17 AM","Created by  EMS from 40 Kootenay, Nelson","Updated by  EMS from 40 Kootenay, Nelson","11/24/1992",""
"E217707","FRUIT WASHING AND PACKING FACILITY","Septic Tank"," Comments:   Legal Description for location of facilities: Lot 44, Plan 457, except Plan 2010","","","","50.023100","-119.3972","","1:50,000 scale map","","","2488","","","","","11/1/1996 10:52:15 AM","7/17/2001 9:01:18 AM","Created by  EMS from 80 Southern Region, Penticton","Updated by  EMS from 80 Southern Region, Penticton","11/24/1992",""
"E217708","PE-42 LAFARGE; RICHMOND - WATER INTAKE","River, Stream, or Creek","AT INTAKE","","","","49.156400","-123.0038","","GOAT- orthoimagery (NAD83)","","","42","","","","","11/1/1996 10:52:15 AM","3/11/1998 6:57:15 PM","Created by  EMS from 20 Lower Mainland, Surrey","Updated by  EMS from 20 Lower Mainland, Surrey","11/25/1992",""
"E217710","REMPLE; HARVEY (PR-11688) OPEN BURN","Open Burning","","","","","50.246900","-116.9619","","GOAT- 1:20,000 TRIM (NAD83)","","","11688","","","","","11/1/1996 10:52:15 AM","12/30/1998 1:20:52 PM","Created by  EMS from 40 Kootenay, Nelson","Updated by HUGH AULD from 40 Kootenay, Nelson","11/25/1992",""
"E217733","RA-15919:RECIPROCATING COMPRESSOR","Stack","Reciprocating Compressor exaust.","","","","56.944896","-122.07435","","1:20,000 scale map (NAD27)","","","15919","","","","","11/1/1996 10:52:16 AM","5/17/2005 8:22:05 AM","Created by  EMS from 70 Omineca-Peace, Prince George","Updated by Steve Jenvey from 70 Omineca-Peace, Prince George","11/30/1992",""
"E217734","RA-15919:TWO POWER GENERATOR EXAUSTS","Stack","two Power Generator Exaust Stacks","","","","56.944896","-122.07435","","1:20,000 scale map (NAD27)","","","15919","","","","","11/1/1996 10:52:16 AM","5/17/2005 9:28:46 AM","Created by  EMS from 70 Omineca-Peace, Prince George","Updated by Steve Jenvey from 70 Omineca-Peace, Prince George","11/30/1992",""
"E217735","RA-15919:STANDBY DIESEL GENERATOR","Stack","Exaust Stack","","","","56.944896","-122.07435","","1:20,000 scale map (NAD27)","","","15919","","","","","11/1/1996 10:52:16 AM","5/17/2005 9:29:54 AM","Created by  EMS from 70 Omineca-Peace, Prince George","Updated by Steve Jenvey from 70 Omineca-Peace, Prince George","11/30/1992",""
"E217737","RA-15919:TWO BOILER HEATING UNITS","Stack","2 Heating Boiler Stacks","","","","56.944896","-122.07435","","1:20,000 scale map (NAD27)","","","15919","","","","","11/1/1996 10:52:16 AM","5/17/2005 9:30:58 AM","Created by  EMS from 70 Omineca-Peace, Prince George","Updated by Steve Jenvey from 70 Omineca-Peace, Prince George","11/30/1992",""
"E217738","RA-15919:FLARE PIT","Stack","Flare Pit Pilot","","","","56.944889","-122.07435","","1:20,000 scale map (NAD27)","","","15919","","","","","11/1/1996 10:52:16 AM","5/17/2005 8:18:31 AM","Created by  EMS from 70 Omineca-Peace, Prince George","Updated by Steve Jenvey from 70 Omineca-Peace, Prince George","11/30/1992",""
"E217739","RA-15919: FOUR FUEL GAS VENTS","Stack","four Feul Gas Vents Comments: Authorized rate of discharge is the rate required to cope with emergencies","","","","56.944896","-122.07435","","1:20,000 scale map (NAD27)","","","15919","","","","","11/1/1996 10:52:16 AM","5/17/2005 9:32:03 AM","Created by  EMS from 70 Omineca-Peace, Prince George","Updated by Steve Jenvey from 70 Omineca-Peace, Prince George","11/30/1992",""
"E217760","OK READY MIX LTD (KELOWNA)","Infiltration Pond","DISCHARGE TO SETTLING POND","","","","50.268700","-119.2681","","1:50,000 scale map","","","1983","","","","","11/1/1996 10:52:17 AM","7/17/2001 8:56:23 AM","Created by  EMS from 80 Southern Region, Penticton","Updated by  EMS from 80 Southern Region, Penticton","12/1/1992",""
"E217888","CPFP;HEAD BAY","Landfill","REFUSE SITE Comments:   STS CREATED DEC 10,1992","","","","49.794700","-126.4917","","1:50,000 scale map","","","8405","","","","","11/1/1996 10:52:20 AM","6/14/1999 2:26:22 PM","Created by  EMS from 10 Vancouver Island, Nanaimo","Updated by  EMS from 10 Vancouver Island, Nanaimo","12/10/1992",""
"E217889","MINSTREL ISLAND","Marine","na","","","","50.614200","-126.3042","","Geographic Positioning System (Datum not known)","","","10768","","","","","11/1/1996 10:52:20 AM","6/14/1999 2:26:22 PM","Created by  EMS from 10 Vancouver Island, Nanaimo","Updated by  EMS from 10 Vancouver Island, Nanaimo","12/10/1992",""
"E217893","QUESNEL; CPP (PA-01578) DISS TANK VENT STACK","Stack","Emissions from the dissolving tank at Cariboo Pulp and Paper operations in Quesnel.","","","","52.998300","-122.4839","","Differential Geographic Positioning System (Datum not known)","","","1578","","","","","11/1/1996 10:52:20 AM","5/9/2005 1:52:41 PM","Created by  EMS from 50 Cariboo, Williams Lake","Updated by Roland Grimm from 50 Cariboo, Williams Lake","12/10/1992",""
"E217896","QUESNEL; CPP (PA-01578) BROWNSTOCK SCRUBBER STACK","Stack","Emissions from the brownstock scrubber at Cariboo Pulp and Paper operations in Quesnel.","","","","52.997200","-122.485","","Differential Geographic Positioning System (Datum not known)","","","1578","","","","","11/1/1996 10:52:20 AM","5/9/2005 1:53:43 PM","Created by  EMS from 50 Cariboo, Williams Lake","Updated by Roland Grimm from 50 Cariboo, Williams Lake","12/11/1992",""
"E218118","PE-11043/GLEN BEATON/STONECROFT FARMS","Tile Field","","","","","49.805800","-125.125","","1:50,000 scale map","","","11043","","","","","11/1/1996 10:52:29 AM","6/14/1999 2:26:24 PM","Created by  EMS from 10 Vancouver Island, Nanaimo","Updated by  EMS from 10 Vancouver Island, Nanaimo","12/21/1992",""
"E218119","PR-8834/GEORGE SURGENOR/LANDCLEARING DEBRIS","Well","Landfill Monitoring Well","","","","49.747200","-125.0028","","GOAT- 1:20,000 TRIM (NAD83)","","","8834","","","","","11/1/1996 10:52:29 AM","11/19/2004 12:05:33 PM","Created by  EMS from 10 Vancouver Island, Nanaimo","Updated by JOHN COLLISON-BAKER from 10 Vancouver Island, Nanaimo","12/21/1992",""
"E218141","PE-1975 OCEAN FISHERIES - SEPTIC TANK EFFL N","Septic Tank","","","","","49.125900","-123.0733","","GOAT- orthoimagery (NAD83)","","","1975","","","","","11/1/1996 10:52:29 AM","4/12/2005 3:14:58 PM","Created by  EMS from 20 Lower Mainland, Surrey","Updated by Dennis Barlow from 20 Lower Mainland, Surrey","12/21/1992",""
"E218142","PE-1975 OCEAN FISHERIES - SEPTIC TANK EFFL S","Septic Tank","","","","","49.124800","-123.0752","","GOAT- orthoimagery (NAD83)","","","1975","","","","","11/1/1996 10:52:29 AM","4/12/2005 3:14:38 PM","Created by  EMS from 20 Lower Mainland, Surrey","Updated by Dennis Barlow from 20 Lower Mainland, Surrey","12/21/1992",""
"E218143","SULLIVAN BAY","Outfall","","","","","50.883100","-126.8289","","Geographic Positioning System (Datum not known)","","","10683","","","","","11/1/1996 10:52:29 AM","6/14/1999 2:27:01 PM","Created by  EMS from 10 Vancouver Island, Nanaimo","Updated by  EMS from 10 Vancouver Island, Nanaimo","12/22/1992",""
"E218199","SEDIMENTATION POND OVERFLOW TO JOCK CR","River, Stream, or Creek"," Comments:   The location of the","","","","57.292800","-126.8022","","GOAT- 1:20,000 TRIM (NAD83)","","","8467","","","","","11/1/1996 10:52:31 AM","3/8/2001 10:06:53 AM","Created by  EMS from 70 Omineca-Peace, Prince George","Updated by   from 70 Omineca-Peace, Prince George","1/12/1993",""
"E218214","AINSWORTH LUMBER (PA-1973) LILLOOET- PRO/BUT HEATERS APP04","Stack","n/a","","","","51.987600","-121.1234","","1:50,000 scale map","","","1973","","","","","11/1/1996 10:52:32 AM","11/6/1997 9:55:12 AM","Created by  EMS from 30 Southern Region, Kamloops","Updated by COLLEEN LAVIOLETTE from 30 Southern Region, Kamloops","1/13/1993",""
"E218215","AINSWORTH LUMBER (PA-1973) LILLOOET - CYCLONES - APP05","Stack","n/a","","","","51.987600","-121.1234","","1:50,000 scale map","","","1973","","","","","11/1/1996 10:52:32 AM","11/6/1997 9:54:39 AM","Created by  EMS from 30 Southern Region, Kamloops","Updated by COLLEEN LAVIOLETTE from 30 Southern Region, Kamloops","1/13/1993",""
"E218216","WAGLISLA;BELLA BELLA FUEL;8803;OIL/WATER SEP.","Outfall","Oil/water separator outlet","","","","52.146700","-128.1428","","GOAT- 1:20,000 TRIM (NAD83)","","","8803","","","","","11/1/1996 10:52:32 AM","3/21/1997 11:20:57 AM","Created by  EMS from 50 Cariboo, Williams Lake","Updated by  EMS from 50 Cariboo, Williams Lake","1/13/1993",""
"E218218","AINSWORTH LUMBER (PA-1973) LILLOOET - MISC VENTS - APP06","Stack","n/a","","","","51.987600","-121.1234","","1:50,000 scale map","","","1973","","","","","11/1/1996 10:52:32 AM","11/6/1997 9:53:24 AM","Created by  EMS from 30 Southern Region, Kamloops","Updated by COLLEEN LAVIOLETTE from 30 Southern Region, Kamloops","1/13/1993",""
