"Location ID","Name","Type","Comment","Country","State","County","Latitude","Longitude","Horizontal Datum","Horizontal Collection Method","Vertical Datum","Vertical Collection Method","Location Groups","Elevation","Elevation Unit","Standards","EA_Closed Date","EA_EMS When Created","EA_EMS When Updated","EA_EMS Who Created","EA_EMS Who Updated","EA_Established Date","EA_Well Tag ID"
"E223667","TEN MILE LK (PE10731) LAGOON","Irrigation Spray/Sludge","spray irrigation sump","","","","53.069100","-122.448","","Differential Geographic Positioning System (Datum not known)","","","10731","","","","","11/1/1996 10:56:04 AM","3/21/1997 11:20:57 AM","Created by  EMS from 50 Cariboo, Williams Lake","Updated by  EMS from 50 Cariboo, Williams Lake","8/16/1996",""
"E223706","JEMICO ENTERPRISES SAWMILL","Stack","chipper cyclone","","","","48.909200","-123.7456","","1:50,000 scale map","","","14416","","","","","11/1/1996 10:56:06 AM","6/14/1999 2:26:54 PM","Created by  EMS from 10 Vancouver Island, Nanaimo","Updated by  EMS from 10 Vancouver Island, Nanaimo","8/27/1996",""
"E223762","INCINERATOR OK PET CREMATION LTD OYAMA","In-Plant","","","","","50.067500","-119.378889","","1:50,000 scale map","","","14520","","","","","11/1/1996 10:56:08 AM","3/24/2005 8:55:16 AM","Created by  EMS from 80 Southern Region, Penticton","Updated by Mike Reiner from 80 Southern Region, Penticton","9/6/1996",""
"E223772","NEWALTA;7720 ANVIL WAY;SURREY;SW STORAGE","Storage","SPECIAL WASTE STORAGE FACILITY Comments: WAST FLAMMABLE LIQUIDS N.O.S.; LEACHABLE TOXIC WASTE (WASTE OIL, OIL FILTERS, ANTI-FREEZE)","","","","49.136000","-122.857","","GOAT- orthoimagery (NAD83)","","","14453","","","","","11/1/1996 10:56:08 AM","4/23/1997 11:43:47 AM","Created by  EMS from 20 Lower Mainland, Surrey","Updated by AVTAR SUNDHER from 20 Lower Mainland, Surrey","9/11/1996",""
"E223776","PA14309 ADAMS CONCRETE-POWELL RIVER","Stack","PA14309 ADAMS CONCRETE - BAGHOUSE STACK","","","","49.837500","-124.5172","","GOAT- orthoimagery (NAD83)","","","14309","","","","","11/1/1996 10:56:09 AM","3/22/2004 4:35:28 PM","Created by  EMS from 20 Lower Mainland, Surrey","Updated by SUSAN WOODBINE from 20 Lower Mainland, Surrey","9/12/1996",""
"E223811","PA-1742: CONDENSATE STORAGE TANK VENT GAS INCINERATOR","Stack","","","","","56.147778","-120.672778","","1:20,000 scale map (NAD27)","","","1742","","","","","11/1/1996 10:56:10 AM","5/9/2005 8:43:58 AM","Created by  EMS from 70 Omineca-Peace, Prince George","Updated by Steve Jenvey from 70 Omineca-Peace, Prince George","10/3/1996",""
"E223832","OUTFALL MARVINAS BAY (PE13879)","Outfall","OUTFALL","","","","49.658800","-126.6233","","GOAT- 1:20,000 TRIM (NAD83)","","","13879","","","","","11/1/1996 10:56:11 AM","7/29/1998 2:51:03 PM","Created by  EMS from 10 Vancouver Island, Nanaimo","Updated by   from 10 Vancouver Island, Nanaimo","10/9/1996",""
"E223833","EASTERLY LANDFILL SITE (PR-14614)","Landfill","","","","","49.937400","-127.0377","","GOAT- 1:20,000 TRIM (NAD83)","","","14614","","","","","11/1/1996 10:56:11 AM","9/8/1998 2:04:06 PM","Created by  EMS from 10 Vancouver Island, Nanaimo","Updated by   from 10 Vancouver Island, Nanaimo","10/9/1996",""
"E223838","ECOWASTE PR-04922 WELL NO. W2A","Well","SEE SITE PLAN","","","","49.150800","-123.0573","","GOAT- orthoimagery (NAD83)","","","4922","","","","","11/1/1996 10:56:11 AM","3/11/1998 6:57:10 PM","Created by  EMS from 20 Lower Mainland, Surrey","Updated by  EMS from 20 Lower Mainland, Surrey","10/10/1996",""
"E223839","TALISMAN SUKUNKA GAS PLANT","Land - Farm","Land treatment of hydrocarbon contaminated soils.","","","","55.300000","-121.69","","GOAT- 1:20,000 TRIM (NAD83)","","","15364","","","","","11/1/1996 10:56:11 AM","5/8/1998 4:38:47 PM","Created by  EMS from 70 Omineca-Peace, Prince George","Updated by IAN MITCHELL from 70 Omineca-Peace, Prince George","10/11/1996",""
"E223840","SPOUT LK (PE14736) RESORT LAGOONS","Infiltration Pond","","","","","52.010300","-121.4514","","GOAT- 1:20,000 TRIM (NAD83)","","","14736","","","","","11/1/1996 10:56:11 AM","12/5/1996 2:20:53 PM","Created by  EMS from 50 Cariboo, Williams Lake","Updated by DOUGLAS HILL from 50 Cariboo, Williams Lake","10/11/1996",""
"E223855","NEW TILE FIELDS FOR THE RESORT","Tile Field","after backwash filter","","","","50.017900","-119.4913","","1:50,000 scale map","","","6113","","","","","11/1/1996 10:56:12 AM","7/17/2001 9:00:32 AM","Created by  EMS from 80 Southern Region, Penticton","Updated by  EMS from 80 Southern Region, Penticton","10/21/1996",""
"E223865","VALLEY RITE-MIX PA-04590 (1.2)  FLYASH SILO","Stack","","","","","49.025100","-122.3483","","GOAT- orthoimagery (NAD83)","","","4590","","","","","11/1/1996 10:56:12 AM","3/16/1999 11:09:55 AM","Created by  EMS from 20 Lower Mainland, Surrey","Updated by George Rushworth from 20 Lower Mainland, Surrey","10/24/1996",""
"E223866","VALLEY RITE-MIX PA-04590 (1.2) AUX. FLYASH SILO","Stack","","","","","49.025100","-122.3482","","GOAT- orthoimagery (NAD83)","","","4590","","","","","11/1/1996 10:56:12 AM","3/16/1999 11:13:44 AM","Created by  EMS from 20 Lower Mainland, Surrey","Updated by George Rushworth from 20 Lower Mainland, Surrey","10/24/1996",""
"E223867","VALLEY RITE-MIX PA-04590 (1.3) DUST COLLECTOR","Stack","","","","","49.025100","-122.3484","","GOAT- orthoimagery (NAD83)","","","4590","","","","","11/1/1996 10:56:12 AM","3/16/1999 11:10:51 AM","Created by  EMS from 20 Lower Mainland, Surrey","Updated by George Rushworth from 20 Lower Mainland, Surrey","10/24/1996",""
"E223868","VALLEY RITE-MIX PA-04590 (1.4) EXISTING HEATER","Stack","","","","","49.025100","-122.348","","GOAT- orthoimagery (NAD83)","","","4590","","","","","11/1/1996 10:56:12 AM","3/16/1999 11:12:34 AM","Created by  EMS from 20 Lower Mainland, Surrey","Updated by George Rushworth from 20 Lower Mainland, Surrey","10/24/1996",""
"E223870","VALLEY RITE-MIX PA-05402 DUST COLLECTOR","Stack","","","","","49.198600","-121.9509","","GOAT- orthoimagery (NAD83)","","","5402","","","","","11/1/1996 10:56:12 AM","5/21/1998 7:47:04 PM","Created by  EMS from 20 Lower Mainland, Surrey","Updated by  EMS from 20 Lower Mainland, Surrey","10/24/1996",""
"E223871","VALLEY RITE-MIX PA-05402 WATER HEATER","Stack","","","","","49.198800","-121.951","","GOAT- orthoimagery (NAD83)","","","5402","","","","","11/1/1996 10:56:12 AM","5/21/1998 7:47:04 PM","Created by  EMS from 20 Lower Mainland, Surrey","Updated by  EMS from 20 Lower Mainland, Surrey","10/24/1996",""
"E223888","CORD (PR12217) WESTBANK LANDFILL","Landfill","Listed on Okanagan region sites as of 20 April 2000 Comments: That part of Lot 3794 which lies to the north of a line 1000 feet (305m) south of the easterly production of the southerly boundary of Lot 3485, ODYD.","","","","49.853000","-119.622","","1:50,000 scale map","","","12217","","","","","11/1/1996 10:56:13 AM","3/18/2004 3:46:12 PM","Created by  EMS from 80 Southern Region, Penticton","Updated by Vic Jensen from 80 Southern Region, Penticton","10/30/1996",""
"E223916","PENROSE (12561) GROUNDWATER WELL #5","Well","Sampled every 2 months","","","","50.010000","-124.724","","1:20,000 scale map (Datum not known)","","","12561","","","","","11/5/1996 8:36:54 AM","11/5/1996 3:05:33 PM","Created by SUSAN WOODBINE from 20 Lower Mainland, Surrey","Updated by SUSAN WOODBINE from 20 Lower Mainland, Surrey","11/5/1996",""
"E223955","D3 CLEAN WATER BYPASS. PRIME RESOURCES GROUP PE-10818","Outfall","Cleanwater runoff is diverted around the D3 treatment system and settling pond. Requires sampling on a routine basis to ensure that contamination is not occuring. If contamination is occuring (> background), treatment is required.","","","","56.652700","-130.4325","","Differential Geographic Positioning System (Datum not known)","","","10818","917.00","metre","","","11/12/1996 2:32:06 PM","11/4/1997 10:56:11 AM","Created by Craig STEWART from 60 Skeena","Updated by Barb Hall from 60 Skeena","11/12/1996",""
"E224092","KOOTENAY WOOD PRESERVERS (PR-13730) OPEN BURN","Open Burning","Caven Creek","","","","49.263300","-115.3083","","GOAT- 1:20,000 TRIM (NAD83)","","","13730","","","","","11/26/1996 10:01:53 AM","4/9/1999 1:36:26 PM","Created by Bill Kusy from 41 Kootenay, Cranbrook","Updated by William (Hugh) Auld from 41 Kootenay, Cranbrook","11/26/1996",""
"E224093","KOOTENAY WOOD PRESERVERS (PR-13730) LANDFILL","Landfill","Caven Creek","","","","49.263300","-115.3083","","GOAT- 1:20,000 TRIM (NAD83)","","","13730","","","","","11/26/1996 10:06:24 AM","4/9/1999 1:37:11 PM","Created by Bill Kusy from 41 Kootenay, Cranbrook","Updated by William (Hugh) Auld from 41 Kootenay, Cranbrook","11/26/1996",""
"E224192","WGSI JEDNEY 1 PA-14698 TWO SALES GAS COMPRESSOR DRIVE UNITS","Stack","One (1) 820 kW and one (1) 948 kW Waukesha L5108 GSI drive units with catalytic conversion and two (2) 10 metre stacks.""","","","","54.563000","-122.456","","1:20,000 scale map (Datum not known)","","","14698","","","","","12/3/1996 3:59:05 PM","6/22/2005 10:59:22 AM","Created by Steve Hunsberger from 70 Omineca-Peace, Prince George","Updated by Ute Muller from 70 Omineca-Peace, Prince George","12/3/1996",""
"E224220","MT. POLLEY (AE 14591) MILL SITE SUMP EFFLUENT (E3)","Outfall","Effluent from the mill site sediment pond (MSSP)			","","","","52.540000","-121.63","","GOAT- 1:20,000 TRIM (NAD83)","","","11678","","","","","12/4/1996 4:13:29 PM","12/29/2000 11:53:34 AM","Created by   from 50 Cariboo, Williams Lake","Updated by Douglas Hill from 50 Cariboo, Williams Lake","12/4/1996",""
"E224222","MID EDNEY CK UPSTREAM OF HAZELTINE (W10)","River, Stream, or Creek","Site also referred to as W10","","","","52.492900","-121.5108","","GOAT- 1:20,000 TRIM (NAD83)","","","11678","","","","","12/5/1996 12:39:34 PM","7/7/1997 8:49:21 AM","Created by   from 50 Cariboo, Williams Lake","Updated by DOUGLAS HILL from 50 Cariboo, Williams Lake","12/5/1996",""
"E224243","QUINSAM RIVER JUST UPTSREAM OF QUINSAM LAKE","River, Stream, or Creek","located just upstream of inlet to Quinsam Lake, accessed off of Gilson Main","","","","49.945000","-125.3991","","GOAT- 1:20,000 TRIM (NAD83)","","","7008","","","","","12/9/1996 1:24:07 PM","4/30/2001 2:59:13 PM","Created by John Deniseger from 10 Vancouver Island, Nanaimo","Updated by Rick Nordin from 10 Vancouver Island, Nanaimo","12/9/1996",""
"E224244","QUINSAM RIVER DOWNSTREAM OF QUINSAM LAKE","River, Stream, or Creek","located approx 2 km downstream of Quinsam Lake, accessed by branch CT-1 off of Gilson Main","","","","49.927000","-125.343","","GOAT- 1:20,000 TRIM (NAD83)","","","7008","","","","","12/9/1996 1:30:30 PM","4/30/2001 2:59:59 PM","Created by John Deniseger from 10 Vancouver Island, Nanaimo","Updated by Rick Nordin from 10 Vancouver Island, Nanaimo","12/9/1996",""
"E224384","#5 RAMP CLEAN MINEWATER DIVERSION. PRIME RESOURCES GROUP PE-10818","Outfall","#5 Ramp clean minewater diversion discharge, Eskay Ck. Mine. Discharge is intercepted groundwater which is diverted to Tom MacKay Ck.","","","","56.654700","-130.4334","","1:50,000 scale map","","","10818","769.00","metre","","","12/20/1996 9:17:00 AM","11/4/1997 10:57:01 AM","Created by Craig STEWART from 60 Skeena","Updated by Barb Hall from 60 Skeena","12/20/1996",""
"E224611","CORD (PR12217) WESTBANK LANDFILL BH1","Well","","","","","49.853000","-119.622","","1:50,000 scale map","","","12217","","","","","1/8/1997 3:10:54 PM","7/17/2001 9:01:54 AM","Created by Conrad Pryce from 80 Southern Region, Penticton","Updated by  EMS from 80 Southern Region, Penticton","1/8/1997",""
"E224612","CORD (PR12217) WESTBANK LANDFILL BH2","Well","","","","","49.853000","-119.622","","1:50,000 scale map","","","12217","","","","","1/8/1997 3:13:19 PM","7/17/2001 9:01:54 AM","Created by Conrad Pryce from 80 Southern Region, Penticton","Updated by  EMS from 80 Southern Region, Penticton","1/8/1997",""
"E224617","CORD (PR12217) WESTBANK LANDFILL BH4","Well","","","","","49.853000","-119.622","","1:50,000 scale map","","","12217","","","","","1/8/1997 3:51:01 PM","7/17/2001 9:01:55 AM","Created by Conrad Pryce from 80 Southern Region, Penticton","Updated by  EMS from 80 Southern Region, Penticton","1/8/1997",""
"E224618","CORD (PR12217) WESTBANK LANDFILL BH5","Well","","","","","49.853000","-119.622","","1:50,000 scale map","","","12217","","","","","1/8/1997 3:52:31 PM","7/17/2001 9:01:55 AM","Created by Conrad Pryce from 80 Southern Region, Penticton","Updated by  EMS from 80 Southern Region, Penticton","1/8/1997",""
"E224620","CORD (PR12217) WESTBANK LANDFILL BH6","Well","","","","","49.853000","-119.622","","1:50,000 scale map","","","12217","","","","","1/8/1997 3:54:06 PM","7/17/2001 9:01:55 AM","Created by Conrad Pryce from 80 Southern Region, Penticton","Updated by  EMS from 80 Southern Region, Penticton","1/8/1997",""
"E224621","CORD (PR12217) WESTBANK LANDFILL BH7","Well","","","","","49.853000","-119.622","","1:50,000 scale map","","","12217","","","","","1/8/1997 3:55:36 PM","7/17/2001 9:01:56 AM","Created by Conrad Pryce from 80 Southern Region, Penticton","Updated by  EMS from 80 Southern Region, Penticton","1/8/1997",""
"E224623","CORD (PR12217) WESTBANK LANDFILL BH8","Well","","","","","49.853000","-119.622","","1:50,000 scale map","","","12217","","","","","1/8/1997 4:03:57 PM","7/17/2001 9:01:56 AM","Created by Conrad Pryce from 80 Southern Region, Penticton","Updated by  EMS from 80 Southern Region, Penticton","1/8/1997",""
"E224624","CORD (PR12217) WESTBANK LANDFILL DOBBINS WELL","Well","","","","","49.853000","-119.622","","1:50,000 scale map","","","12217","","","","","1/8/1997 4:14:50 PM","7/17/2001 9:01:57 AM","Created by Conrad Pryce from 80 Southern Region, Penticton","Updated by  EMS from 80 Southern Region, Penticton","1/8/1997",""
"E224625","GALENA BAY DEVELOPMENT CORP. (PE-14294) EFFLUENT DISCHARGE","Tile Field","","","","","50.670900","-117.8416","","GOAT- 1:20,000 TRIM (NAD83)","","","14294; 105366","","","","","1/8/1997 4:30:28 PM","1/6/1998 10:29:06 AM","Created by Sharon Ferguson from 40 Kootenay, Nelson","Updated by HUGH AULD from 40 Kootenay, Nelson","1/8/1997",""
"E224704","SWANESET BAY RESORT (PE-10721) SPRAY IRRIGATION","Irrigation Spray/Sludge","Spray irrigation to the onsite golf courses.  Discharge is seasonal, from May 1 to Sept 30 inclusive.				","","","","49.306800","-122.6599","","GOAT- orthoimagery (NAD83)","","","10721","","","","","1/22/1997 1:44:06 PM","4/8/1998 8:59:51 AM","Created by SUSAN WOODBINE from 20 Lower Mainland, Surrey","Updated by SUSAN WOODBINE from 20 Lower Mainland, Surrey","1/22/1997",""
"E224844","DISTRICT OF SALMON ARM (PE-11402) STP SLUDGE DISPOSAL","Irrigation Spray/Sludge","Sewage sludge originates from the Salmon Arm Sewage Treatment Facility in Salmon Arm. Area of disposal is the local airport lands in Salmon Arm as well as various farm lands in the future.","","","","50.683900","-119.6839","","1:50,000 scale map","","","11402","","","","","2/3/1997 2:43:30 PM","3/2/1998 9:58:45 AM","Created by Dean Jeske from 30 Southern Region, Kamloops","Updated by COLLEEN LAVIOLETTE from 30 Southern Region, Kamloops","10/21/1996",""
"E224924","WEI; CABIN LK.; COMPRESSORS","Stack","Two Gas Turbine Compressor Drive Units","","","","59.200000","-121.6","","1:50,000 scale map","","","14268","695.00","metre","","","2/7/1997 9:03:39 AM","2/7/1997 9:12:06 AM","Created by Steve Hunsberger from 70 Omineca-Peace, Prince George","Updated by Steve Hunsberger from 70 Omineca-Peace, Prince George","2/7/1997",""
"E224926","WEI; CABIN LK.; ACID GAS INCINERATOR","Stack","One Acid Gas (L.P.) incinerator","","","","59.200000","-121.6","","1:50,000 scale map","","","14268","695.00","metre","","8/15/1998","2/7/1997 9:14:49 AM","3/4/2003 8:20:14 AM","Created by Steve Hunsberger from 70 Omineca-Peace, Prince George","Updated by Lisa Barkowsky from 70 Omineca-Peace, Prince George","2/7/1997",""
"E224984","ULKATCHO (PE14417) WETLAND #4 EFFLUENT (SP6)","Outfall","sample at outlet of wetland at NE corner of I.R. 14A","","","","52.458300","-125.2667","","1:50,000 scale map","","","14417","","","","","2/11/1997 9:30:41 AM","2/26/1997 1:33:46 PM","Created by DOUGLAS HILL from 50 Cariboo, Williams Lake","Updated by DOUGLAS HILL from 50 Cariboo, Williams Lake","2/11/1997",""
"E224987","PA-2737: 1 - 5200 KW TURBINE COMPRESSOR DRIVE","Stack","","","","","56.141861","-120.669556","","1:20,000 scale map (NAD27)","","","2737","459.00","metre","","","2/11/1997 10:57:50 AM","5/9/2005 10:53:54 AM","Created by Steve Hunsberger from 70 Omineca-Peace, Prince George","Updated by Steve Jenvey from 70 Omineca-Peace, Prince George","2/11/1997",""
"E224988","PA-2737: 1- 3840 KW BOOSTER GAS TURBINE DRIVE","Stack","","","","","56.142278","-120.669639","","1:20,000 scale map (NAD27)","","","2737","459.00","metre","","","2/11/1997 11:01:21 AM","5/9/2005 10:56:33 AM","Created by Steve Hunsberger from 70 Omineca-Peace, Prince George","Updated by Steve Jenvey from 70 Omineca-Peace, Prince George","2/11/1997",""
"E224989","PA-2737: 1 - 1500 KW LEAN BURN INGERSOLL RAND KVS","Stack","","","","","56.142278","-120.669639","","1:20,000 scale map (NAD27)","","","2737","459.00","metre","","","2/11/1997 11:04:04 AM","5/9/2005 10:58:39 AM","Created by Steve Hunsberger from 70 Omineca-Peace, Prince George","Updated by Steve Jenvey from 70 Omineca-Peace, Prince George","2/11/1997",""
"E224990","PA-2737: TURBINE STARTING GAS EMISSIONS","Stack","non-comnusted sweet natural gas","","","","56.142278","-120.669639","","1:20,000 scale map (NAD27)","","","2737","459.00","metre","","","2/11/1997 11:05:46 AM","5/9/2005 11:06:50 AM","Created by Steve Hunsberger from 70 Omineca-Peace, Prince George","Updated by Steve Jenvey from 70 Omineca-Peace, Prince George","2/11/1997",""
"E225085","EDNEY CR TRIB NE U/S DITCH (W8C)","River, Stream, or Creek","site known as W8c, located u/s of water diversion ditch draining to Edney Tributary NE, below tailings dam, and u/s of W8","","","","52.500800","-121.5737","","1:50,000 scale map","","","11678","","","","","2/17/1997 4:09:17 PM","10/30/1997 9:50:16 AM","Created by DOUGLAS HILL from 50 Cariboo, Williams Lake","Updated by DOUGLAS HILL from 50 Cariboo, Williams Lake","2/17/1997",""
"E225167","ULKATCHO (PE14417) WETLAND #1 EFFLUENT (SP1)","In-Plant","outflow from wetland #1","","","","52.443800","-125.288","","GOAT- 1:20,000 TRIM (NAD83)","","","14417","","","","","2/26/1997 8:32:27 AM","2/26/1997 1:40:43 PM","Created by DOUGLAS HILL from 50 Cariboo, Williams Lake","Updated by DOUGLAS HILL from 50 Cariboo, Williams Lake","2/26/1997",""
"E225168","ULKATCHO (PE14417) WETLAND #2 EFFLUENT (SP2)","In-Plant","at outlet of wetland #2","","","","52.447400","-125.2927","","GOAT- 1:20,000 TRIM (NAD83)","","","14417","","","","","2/26/1997 8:34:19 AM","2/26/1997 1:41:24 PM","Created by DOUGLAS HILL from 50 Cariboo, Williams Lake","Updated by DOUGLAS HILL from 50 Cariboo, Williams Lake","2/26/1997",""
"E225169","ULKATCHO (PE14417) WETLAND #3 EFFLUENT (SP4)","In-Plant","at outlet of wetland #3","","","","52.453100","-125.296","","GOAT- 1:20,000 TRIM (NAD83)","","","14417","","","","","2/26/1997 8:39:28 AM","2/26/1997 1:44:13 PM","Created by DOUGLAS HILL from 50 Cariboo, Williams Lake","Updated by DOUGLAS HILL from 50 Cariboo, Williams Lake","2/26/1997",""
"E225170","ULKATCHO (PE14417) WETLAND #4 INFLUENT (SP5)","In-Plant","inflow to wetland 4 from flow coming past airport cross runway, through culvert under highway near trailer park","","","","52.458800","-125.2917","","GOAT- 1:20,000 TRIM (NAD83)","","","14417","","","","","2/26/1997 8:41:51 AM","2/26/1997 1:44:54 PM","Created by DOUGLAS HILL from 50 Cariboo, Williams Lake","Updated by DOUGLAS HILL from 50 Cariboo, Williams Lake","2/26/1997",""
"E225172","DEAN RIVER U/S HOLTRY CREEK","River, Stream, or Creek","site located about 0.5 km u/s of confluence of Dean R. and Holtry Cr.","","","","52.440300","-125.2518","","GOAT- 1:20,000 TRIM (NAD83)","","","14417","","","","","2/26/1997 8:53:34 AM","2/26/1997 1:46:21 PM","Created by DOUGLAS HILL from 50 Cariboo, Williams Lake","Updated by DOUGLAS HILL from 50 Cariboo, Williams Lake","2/26/1997",""
"E225173","DEAN RIVER U/S I.R.14A","River, Stream, or Creek","sample just upstream of outflow from large wetland at NE corner of reserve","","","","52.456200","-125.2652","","GOAT- 1:20,000 TRIM (NAD83)","","","14417","","","","","2/26/1997 8:55:25 AM","2/26/1997 1:47:12 PM","Created by DOUGLAS HILL from 50 Cariboo, Williams Lake","Updated by DOUGLAS HILL from 50 Cariboo, Williams Lake","2/26/1997",""
"E225174","DEAN RIVER INFLOW TO ANAHIM LAKE","River, Stream, or Creek","sample just u/s of point where river flows into SE end of lake, access site from trail starting from Christiansen Rd. about 0.8 km north of stampede grounds","","","","52.478400","-125.3129","","GOAT- 1:20,000 TRIM (NAD83)","","","14417","","","","","2/26/1997 8:59:37 AM","2/26/1997 1:47:58 PM","Created by DOUGLAS HILL from 50 Cariboo, Williams Lake","Updated by DOUGLAS HILL from 50 Cariboo, Williams Lake","2/26/1997",""
"E225175","DEAN RIVER OUTFLOW FROM ANAHIM LAKE","River, Stream, or Creek","sample river at outlet of Anahim Lake located at its NW end","","","","52.519000","-125.3798","","GOAT- 1:20,000 TRIM (NAD83)","","","14417","","","","","2/26/1997 9:01:09 AM","2/26/1997 1:48:58 PM","Created by DOUGLAS HILL from 50 Cariboo, Williams Lake","Updated by DOUGLAS HILL from 50 Cariboo, Williams Lake","2/26/1997",""
"E225176","DEAN RIVER U/S DAGG CREEK","River, Stream, or Creek","sample Dean R. just upstream of its confluence with Dagg Cr. on upstream side of small farm bridge","","","","52.460000","-125.2634","","GOAT- 1:20,000 TRIM (NAD83)","","","14417","","","","","2/26/1997 9:32:48 AM","2/26/1997 1:49:53 PM","Created by DOUGLAS HILL from 50 Cariboo, Williams Lake","Updated by DOUGLAS HILL from 50 Cariboo, Williams Lake","2/26/1997",""
"E225177","HOLTRY CREEK @ CONFLUENCE W/ DEAN","River, Stream, or Creek","sample Holtry just u/s of its confluence with Dean River, site is on south side of road west of bridge crossing Dean R.","","","","52.445200","-125.2491","","GOAT- 1:20,000 TRIM (NAD83)","","","14417","","","","","2/26/1997 9:34:37 AM","2/26/1997 1:50:33 PM","Created by DOUGLAS HILL from 50 Cariboo, Williams Lake","Updated by DOUGLAS HILL from 50 Cariboo, Williams Lake","2/26/1997",""
"E225204","MASSET (PR-14834) LAND CLEARING DEBRIS DISPOSAL","Landfill","","","","","54.007800","-132.1106","","Geographic Positioning System (Datum not known)","","","14834","","","","","3/4/1997 3:59:51 PM","5/8/1997 9:25:34 AM","Created by JOHN COLLISON-BAKER from 60 Skeena","Updated by JOHN COLLISON-BAKER from 60 Skeena","3/4/1997",""
"E225233","HOMESTAKE CANADA INC  (PA 7612) WATER HEATER EMISSIONS","Stack","","","","","49.373000","-120.0167","","1:50,000 scale map","","","7612","","","","","3/10/1997 9:42:57 AM","7/17/2001 9:02:31 AM","Created by Mike Reiner from 80 Southern Region, Penticton","Updated by  EMS from 80 Southern Region, Penticton","3/10/1997",""
"E225329","PA-3449: 1 - LEAN BURN COMPRESSOR DRIVE","Stack","Lean burn compressor drive unit, 1475kW Comments: Lat. & Long. updated Sept 7/01 to coordinates of Prince George regional office.","","","","56.652667","-120.783417","","1:20,000 scale map (NAD27)","","","3449","","","","","3/19/1997 1:26:07 PM","4/27/2005 2:42:16 PM","Created by Steve Hunsberger from 70 Omineca-Peace, Prince George","Updated by Steve Jenvey from 70 Omineca-Peace, Prince George","3/19/1997",""
"E225330","PA-3449: 3 - CONVENTIONAL COMPRESSOR DRIVES","Stack","two 525 kW and one 495 kW conventional compressor drive units Comments: Lat. & Long. updated Sept 7/01 to coordinates of Prince George regional office.","","","","56.652667","-120.783417","","1:20,000 scale map (NAD27)","","","3449","0.00","metre","","","3/19/1997 1:28:16 PM","4/27/2005 2:43:16 PM","Created by Steve Hunsberger from 70 Omineca-Peace, Prince George","Updated by Steve Jenvey from 70 Omineca-Peace, Prince George","3/19/1997",""
"E225331","PA-3449: 2 - GENERATOR DRIVE UNITS","Stack","two 340 kW conventional reciprocating generator drive units Comments: Lat. & Long. updated Sept 7/01 to coordinates of Prince George regional office.","","","","56.652667","-120.783417","","1:50,000 scale map","","","3449","","","","","3/19/1997 1:29:52 PM","4/27/2005 2:44:14 PM","Created by Steve Hunsberger from 70 Omineca-Peace, Prince George","Updated by Steve Jenvey from 70 Omineca-Peace, Prince George","3/19/1997",""
"E225332","PA-3449: 1 STANDBY GENERATOR DRIVER","Stack","one 113 kW emergency diesel generator drive unit  Comments: Lat. & Long. updated Sept 7/01 to coordinates of Prince George regional office.","","","","56.652667","-120.783417","","1:20,000 scale map (NAD27)","","","3449","0.00","metre","","","3/19/1997 1:38:11 PM","4/27/2005 2:40:23 PM","Created by Steve Hunsberger from 70 Omineca-Peace, Prince George","Updated by Steve Jenvey from 70 Omineca-Peace, Prince George","3/19/1997",""
"E225333","PA-3449: 4 - HEATING BOILERS","Stack","four heating boilers Comments: Lat. & Long. updated Sept 7/01 to coordinates of Prince George regional office.","","","","56.652667","-120.783417","","1:20,000 scale map (NAD27)","","","3449","0.00","metre","","","3/19/1997 1:40:47 PM","4/27/2005 2:45:03 PM","Created by Steve Hunsberger from 70 Omineca-Peace, Prince George","Updated by Steve Jenvey from 70 Omineca-Peace, Prince George","3/19/1997",""
"E225334","PA-3449: RIGEL FLARE PIT","Stack","emergency flare pit Comments: Lat. & Long. updated Sept 7/01 to coordinates of Prince George regional office.","","","","56.652667","-120.783417","","1:20,000 scale map (NAD27)","","","3449","","","","","3/19/1997 1:42:38 PM","4/27/2005 2:46:04 PM","Created by Steve Hunsberger from 70 Omineca-Peace, Prince George","Updated by Steve Jenvey from 70 Omineca-Peace, Prince George","3/19/1997",""
