"Location ID","Name","Type","Comment","Country","State","County","Latitude","Longitude","Horizontal Datum","Horizontal Collection Method","Vertical Datum","Vertical Collection Method","Location Groups","Elevation","Elevation Unit","Standards","EA_Closed Date","EA_EMS When Created","EA_EMS When Updated","EA_EMS Who Created","EA_EMS Who Updated","EA_Established Date","EA_Well Tag ID"
"E210963","MOOYAH BAY D.L.S. (PR07800)","Landfill","REFUSE SITE","","","","49.636700","-126.4717","","Geographic Positioning System (Datum not known)","","","7800","","","","","11/1/1996 10:48:48 AM","6/14/1999 2:25:45 PM","Created by  EMS from 10 Vancouver Island, Nanaimo","Updated by  EMS from 10 Vancouver Island, Nanaimo","8/24/1990",""
"E210964","ZEBALLOS D.L.S. (PR08190)","Landfill","REFUSE SITE","","","","49.995000","-126.8517","","Geographic Positioning System (Datum not known)","","","8190","","","","","11/1/1996 10:48:48 AM","6/14/1999 2:26:59 PM","Created by  EMS from 10 Vancouver Island, Nanaimo","Updated by  EMS from 10 Vancouver Island, Nanaimo","8/24/1990",""
"E210967","WILSON CREEK DLS (PR07269)","Landfill","REFUSE SITE Comments:   ~ 130M S AND 180M N OF THE NW CORNER OF LOT 2, CLAYOQUOT LAND DIST.","","","","49.643300","-126.17","","Geographic Positioning System (Datum not known)","","","7269","","","","","11/1/1996 10:48:48 AM","6/14/1999 2:25:45 PM","Created by  EMS from 10 Vancouver Island, Nanaimo","Updated by  EMS from 10 Vancouver Island, Nanaimo","8/24/1990",""
"E210968","KENDRICK ARM D.L.S. (PR07561)","Landfill","REFUSE SITE Comments:   ~340M W AND 160M S OT SE CORNER OF TO362, NOOTKA LAND DISTRICT","","","","49.718300","-126.6517","","Geographic Positioning System (Datum not known)","","","7561","","","","","11/1/1996 10:48:49 AM","6/14/1999 2:25:45 PM","Created by  EMS from 10 Vancouver Island, Nanaimo","Updated by  EMS from 10 Vancouver Island, Nanaimo","8/24/1990",""
"E210976","RDFFG MCBRIDE LF PR6424","Landfill","","","","","53.403100","-120.4203","","Geographic Positioning System (NAD83)","","","6424","","","","","11/1/1996 10:48:49 AM","8/16/2004 9:45:51 AM","Created by  EMS from 70 Omineca-Peace, Prince George","Updated by Victoria Hill from 70 Omineca-Peace, Prince George","8/24/1990",""
"E210993","LANDFILL SITE -  PR6689","Landfill","REFUSE DISPOSAL TRENCH - scrap metal.","","","","53.297500","-123.1536","","1:50,000 scale map","","","6689","","","","","11/1/1996 10:48:50 AM","2/22/2000 11:36:44 AM","Created by  EMS from 70 Omineca-Peace, Prince George","Updated by MAUREEN BILAWCHUK from 70 Omineca-Peace, Prince George","8/24/1990",""
"E210996","FF1-2 (PR06207) OPEN BURN SITE","Open Burning","OPEN BURN PIT","","","","55.322800","-123.1742","","1:50,000 scale map","","","6207","","","","10/25/1999","11/1/1996 10:48:50 AM","10/26/1999 9:53:50 AM","Created by  EMS from 70 Omineca-Peace, Prince George","Updated by MAUREEN BILAWCHUK from 70 Omineca-Peace, Prince George","8/24/1990",""
"E211008","BRKICH TRAILER PARK PG PE1566 RAW INFLOW","In-Plant","INFLOW TO TREATMENT LAGOON","","","","53.845600","-122.7153","","GOAT- 1:20,000 TRIM (NAD83)","","","1566","","","","","11/1/1996 10:48:51 AM","12/23/1997 4:12:26 PM","Created by  EMS from 70 Omineca-Peace, Prince George","Updated by Ben Van Nostrand from 70 Omineca-Peace, Prince George","7/2/1993",""
"E211018","PRINCE GEORGE HART LANDFILL PR1697","Landfill","","","","","53.987500","-122.8253","","GOAT- 1:20,000 TRIM (NAD83)","","","1697","","","","","11/1/1996 10:48:52 AM","3/12/1998 3:54:46 PM","Created by  EMS from 70 Omineca-Peace, Prince George","Updated by Ben Van Nostrand from 70 Omineca-Peace, Prince George","8/25/1990",""
"E211044","FFI SITE 1 (PA 3057) SAWMILL BURNER","Stack","","","","","55.344200","-123.1847","","1:50,000 scale map","","","3057","","","","7/14/1997","11/1/1996 10:48:53 AM","8/13/1997 4:22:43 PM","Created by  EMS from 70 Omineca-Peace, Prince George","Updated by MAUREEN BILAWCHUK from 70 Omineca-Peace, Prince George","8/25/1990",""
"E211058","PA-02119 SULPHURIC ACID PLANT","Stack","","","","","53.840600","-122.7311","","1:50,000 scale map","","","2119","","","","","11/1/1996 10:48:54 AM","12/17/2003 4:08:12 PM","Created by  EMS from 70 Omineca-Peace, Prince George","Updated by MAUREEN BILAWCHUK from 70 Omineca-Peace, Prince George","8/25/1990",""
"E211059","PA-02119 LIQUID SULPHUR STORAGE PITS AND STORAGE TANK","Stack","","","","","53.840600","-122.7311","","1:50,000 scale map","","","2119","","","","","11/1/1996 10:48:54 AM","12/17/2003 4:10:01 PM","Created by  EMS from 70 Omineca-Peace, Prince George","Updated by MAUREEN BILAWCHUK from 70 Omineca-Peace, Prince George","8/25/1990",""
"E211060","PA-02119 SULPHURIC ACID PUMP TANKS AND STORAGE TANKS","Stack","","","","","53.840600","-122.7311","","1:50,000 scale map","","","2119","","","","","11/1/1996 10:48:54 AM","12/17/2003 4:12:02 PM","Created by  EMS from 70 Omineca-Peace, Prince George","Updated by MAUREEN BILAWCHUK from 70 Omineca-Peace, Prince George","8/25/1990",""
"E211061","PA-02119 SULPHURIC ACID LOADING STATION","Stack","","","","","53.840600","-122.7311","","1:50,000 scale map","","","2119","","","","","11/1/1996 10:48:54 AM","12/17/2003 4:14:33 PM","Created by  EMS from 70 Omineca-Peace, Prince George","Updated by MAUREEN BILAWCHUK from 70 Omineca-Peace, Prince George","8/25/1990",""
"E211062","PA-02119 ALUM PLANT REACTOR","Stack","","","","","53.840600","-122.7311","","1:50,000 scale map","","","2119","","","","","11/1/1996 10:48:54 AM","12/17/2003 4:15:23 PM","Created by  EMS from 70 Omineca-Peace, Prince George","Updated by MAUREEN BILAWCHUK from 70 Omineca-Peace, Prince George","8/25/1990",""
"E211063","PA-02119 ALUM PLANT EVAPORATORS","Stack","","","","","53.840600","-122.7311","","1:50,000 scale map","","","2119","","","","","11/1/1996 10:48:54 AM","12/17/2003 4:26:35 PM","Created by  EMS from 70 Omineca-Peace, Prince George","Updated by MAUREEN BILAWCHUK from 70 Omineca-Peace, Prince George","8/25/1990",""
"E211064","PA-02119 ALUM STORAGE BIN AND LOADING HOPPER","Stack","","","","","53.840600","-122.7311","","1:50,000 scale map","","","2119","","","","","11/1/1996 10:48:54 AM","12/17/2003 4:22:12 PM","Created by  EMS from 70 Omineca-Peace, Prince George","Updated by MAUREEN BILAWCHUK from 70 Omineca-Peace, Prince George","8/25/1990",""
"E211065","PA-02119 ALUM PLANT STORAGE TANK","Stack","","","","","53.840600","-122.7311","","1:50,000 scale map","","","2119","","","","","11/1/1996 10:48:54 AM","12/17/2003 4:31:37 PM","Created by  EMS from 70 Omineca-Peace, Prince George","Updated by MAUREEN BILAWCHUK from 70 Omineca-Peace, Prince George","8/25/1990",""
"E211066","PA-02119 POWER BOILER","Stack","","","","","53.840600","-122.7311","","1:50,000 scale map","","","2119","","","","","11/1/1996 10:48:54 AM","12/17/2003 4:34:32 PM","Created by  EMS from 70 Omineca-Peace, Prince George","Updated by MAUREEN BILAWCHUK from 70 Omineca-Peace, Prince George","8/25/1990",""
"E211081","SILVA BAY MARINA OUTFALL - PE323","Outfall","EFFLUENT DISCHARGE","","","","49.150000","-123.6964","","Geographic Positioning System (Datum not known)","","","323","","","","","11/1/1996 10:48:55 AM","6/14/1999 2:25:46 PM","Created by  EMS from 10 Vancouver Island, Nanaimo","Updated by  EMS from 10 Vancouver Island, Nanaimo","8/27/1990",""
"E211092","RDAC - WESTCOAST LANDFILL - PR5634","Landfill","REFUSE DISCHARGE Comments:   UNSURVEYED 6 HECTARES IN THE SOUTHEAST CORNER OF DISTRICT LOT 1399, CLAYOQUOT LAND DISTRICT","","","","49.043300","-125.6731","","Geographic Positioning System (Datum not known)","","","5634","","","","","11/1/1996 10:48:55 AM","6/14/1999 2:25:46 PM","Created by  EMS from 10 Vancouver Island, Nanaimo","Updated by  EMS from 10 Vancouver Island, Nanaimo","8/27/1990",""
"E211094","SANDHILL CREEK TRIBUTARY - U/S PR5634","River, Stream, or Creek","UPSTREAM OF PR5634 LEACHATE STREAM","","","","48.594700","-123.4053","","GOAT- 1:20,000 TRIM (NAD83)","","","5634","","","","","11/1/1996 10:48:56 AM","1/16/2001 9:46:01 AM","Created by  EMS from 10 Vancouver Island, Nanaimo","Updated by   from 10 Vancouver Island, Nanaimo","8/27/1990",""
"E211095","SANDHILL CREEK TRIBUTARY 100M D/S PR5634","River, Stream, or Creek","100M DOWNSTREAM OF LEACHATE STREAM","","","","48.592200","-123.3994","","GOAT- 1:20,000 TRIM (NAD83)","","","5634","","","","","11/1/1996 10:48:56 AM","1/16/2001 9:47:29 AM","Created by  EMS from 10 Vancouver Island, Nanaimo","Updated by   from 10 Vancouver Island, Nanaimo","8/27/1990",""
"E211098","RDPR - LASQUETI ISLAND - PR4904","Landfill","REFUSE DISCHARGEREFUSE DISCHARGE Comments:   SOUTHEAST 40 ACRES OF NORTHWEST 1/4 OF SECTION 18, LASQUETI ISLAND, NANAIMO LAND DISTRICT","","","","49.489700","-124.2683","","Geographic Positioning System (Datum not known)","","","4904","","","","","11/1/1996 10:48:56 AM","6/14/1999 2:26:55 PM","Created by  EMS from 10 Vancouver Island, Nanaimo","Updated by  EMS from 10 Vancouver Island, Nanaimo","8/27/1990",""
"E211100","RDCS - CUMBERLAND - PR5050","Landfill","REFUSE DISCHARGEREFUSE DISCHARGE","","","","49.636700","-125.0503","","1:50,000 scale map","","","5050","","","","","11/1/1996 10:48:56 AM","6/14/1999 2:25:46 PM","Created by  EMS from 10 Vancouver Island, Nanaimo","Updated by  EMS from 10 Vancouver Island, Nanaimo","8/27/1990",""
"E211102","MURPHY - SUNSHINE BAY (PE08274)","Outfall","OUTFALLOUTFALL Comments:   SEPTIC TANK TREATED DOMESTIC EFFLUENT EXCEPT TOILET WASTE","","","","48.980600","-125.0367","","1:50,000 scale map","","","8274","","","","","11/1/1996 10:48:56 AM","6/14/1999 2:25:47 PM","Created by  EMS from 10 Vancouver Island, Nanaimo","Updated by  EMS from 10 Vancouver Island, Nanaimo","8/27/1990",""
"E211103","CLAYOQUOT OUTFALL PE8069","Outfall","EFFLUENTEFFLUENT Comments:   OPITSAHT INDIAN RESERVE NO. 1, PLAN B.C.176 (C.L.S.R.), FIELD BOOK B.C. 404","","","","49.173300","-125.9103","","Geographic Positioning System (Datum not known)","","","8069","","","","","11/1/1996 10:48:56 AM","6/14/1999 2:25:47 PM","Created by  EMS from 10 Vancouver Island, Nanaimo","Updated by  EMS from 10 Vancouver Island, Nanaimo","8/27/1990",""
"E211111","READ ISLAND SCHOOL (PE06794)","Outfall","PLUME ABOVE OUTFALL","","","","50.226700","-125.1167","","Geographic Positioning System (Datum not known)","","","6794","","","","","11/1/1996 10:48:56 AM","6/14/1999 2:25:47 PM","Created by  EMS from 10 Vancouver Island, Nanaimo","Updated by  EMS from 10 Vancouver Island, Nanaimo","8/27/1990",""
"E211112","BERRY ISLAND (PE06692)","Outfall","PLUME ABOVE OUTFALL Comments:   LOT 1, D.L.840, RANGE 1, COAST DISTRICT, PLAN 30661 AND PART OF LOT 840, RANGE 1, COAST DISTRICT, PLAN 1746-R","","","","50.606400","-126.6731","","Geographic Positioning System (Datum not known)","","","6692","","","","","11/1/1996 10:48:56 AM","6/14/1999 2:26:56 PM","Created by  EMS from 10 Vancouver Island, Nanaimo","Updated by  EMS from 10 Vancouver Island, Nanaimo","8/27/1990",""
"E211120","APRIL POINT LODGE (PE06053)","Marine","PLUME ABOVE DIS.","","","","50.068100","-125.23","","Geographic Positioning System (Datum not known)","","","6053","","","","","11/1/1996 10:48:57 AM","6/14/1999 2:25:47 PM","Created by  EMS from 10 Vancouver Island, Nanaimo","Updated by  EMS from 10 Vancouver Island, Nanaimo","8/27/1990",""
"E211123","WINTER HARBOUR FISH STATION (PE05999)","Marine","PLUME ABOVE OUTFALL","","","","50.540800","-127.995","","Geographic Positioning System (Datum not known)","","","5999","","","","","11/1/1996 10:48:57 AM","6/14/1999 2:25:47 PM","Created by  EMS from 10 Vancouver Island, Nanaimo","Updated by  EMS from 10 Vancouver Island, Nanaimo","8/27/1990",""
"E211124","BAUZA COVE CAMPSITE PE 5975","Tile Field","TILE FIELD SAMPLING PORT","","","","50.543300","-126.8214","","Geographic Positioning System (Datum not known)","","","5975","","","","","11/1/1996 10:48:57 AM","6/14/1999 2:25:48 PM","Created by  EMS from 10 Vancouver Island, Nanaimo","Updated by  EMS from 10 Vancouver Island, Nanaimo","8/27/1990",""
"E211132","BEAVER COVE LOG SORT (PE05291)","Marine","PLUME ABOVE OUTFALL","","","","50.532800","-126.8589","","1:50,000 scale map","","","5291","","","","","11/1/1996 10:48:57 AM","6/14/1999 2:25:48 PM","Created by  EMS from 10 Vancouver Island, Nanaimo","Updated by  EMS from 10 Vancouver Island, Nanaimo","8/27/1990",""
"E211133","SD #57- BUCKHORN (PE5032)- OUTFALL","Outfall","OUTFALL TO TABOR CREEK","","","","53.792350","-122.6459","","Geographic Positioning System (NAD83)","","","5032","","","","","11/1/1996 10:48:57 AM","5/10/2005 2:01:56 PM","Created by  EMS from 70 Omineca-Peace, Prince George","Updated by Steve Jenvey from 70 Omineca-Peace, Prince George","8/27/1990",""
"E211145","BEDNESTI LAKE RESORT (PE8075) SPRAY DISCHARGE","Irrigation Spray/Sludge","TRICKLE IRRIGATION DISCHARGE","","","","53.876100","-123.4008","","1:50,000 scale map","","","8075","","","","","11/1/1996 10:48:57 AM","8/27/1998 11:10:13 AM","Created by  EMS from 70 Omineca-Peace, Prince George","Updated by Ben Van Nostrand from 70 Omineca-Peace, Prince George","8/27/1990",""
"E211146","BEDNESTI LAKE RESORT (PE8075) RAW INFLOW","In-Plant","RAW SEWAGE INFLOW TO PRIMARY LAGOONRAW SEWAGE","","","","53.876100","-123.4008","","1:50,000 scale map","","","8075","","","","","11/1/1996 10:48:57 AM","8/27/1998 11:10:56 AM","Created by  EMS from 70 Omineca-Peace, Prince George","Updated by Ben Van Nostrand from 70 Omineca-Peace, Prince George","8/27/1990",""
"E211147","BEDNESTI LAKE RESORT (PE8075) INFLOW TO STORAGE LAGOON","In-Plant","INFLOW TO STORAGE LAGOON","","","","53.876100","-123.4008","","1:50,000 scale map","","","8075","","","","","11/1/1996 10:48:57 AM","8/27/1998 11:11:32 AM","Created by  EMS from 70 Omineca-Peace, Prince George","Updated by Ben Van Nostrand from 70 Omineca-Peace, Prince George","8/27/1990",""
"E211151","DENNIS SEIMENS","Outfall","PLUME ABOVE OUTFALL","","","","50.094700","-127.2817","","1:50,000 scale map","","","4678","","","","","11/1/1996 10:48:58 AM","6/14/1999 2:25:49 PM","Created by  EMS from 10 Vancouver Island, Nanaimo","Updated by  EMS from 10 Vancouver Island, Nanaimo","8/28/1990",""
"E211152","MOOYAH BAY DISCHARGE","Outfall","PLUME ABOVE OUTFALL","","","","49.633100","-126.4564","","Geographic Positioning System (Datum not known)","","","4617","","","","","11/1/1996 10:48:58 AM","6/14/1999 2:25:49 PM","Created by  EMS from 10 Vancouver Island, Nanaimo","Updated by  EMS from 10 Vancouver Island, Nanaimo","8/28/1990",""
"E211154","CHAMISS BAY (PE04103)","Outfall","SURFACE ABOVE OUTFALL Comments:   CHAMISS BAY LOGGING CAMP, 20 CHAINS N & 3 CHAINS W OF NE CORNER OF T.L.3806","","","","50.069400","-127.2861","","1:50,000 scale map","","","4103","","","","","11/1/1996 10:48:58 AM","6/14/1999 2:26:56 PM","Created by  EMS from 10 Vancouver Island, Nanaimo","Updated by  EMS from 10 Vancouver Island, Nanaimo","8/28/1990",""
"E211155","PORT ALICE OUTFALL (PE00324)","Outfall","Effluent weir","","","","50.260000","-127.29","","1:50,000 scale map","","","324","","","","","11/1/1996 10:48:58 AM","1/14/1997 2:51:06 PM","Created by  EMS from 10 Vancouver Island, Nanaimo","Updated by   from 10 Vancouver Island, Nanaimo","8/28/1990",""
"E211207","PNG SITE #1","Infiltration Pond","NON QUARANTINE HATCHERYEFFLUENT DISCHARGE","","","","49.323600","-124.9914","","1:50,000 scale map","","","5311","","","","","11/1/1996 10:49:00 AM","6/14/1999 2:25:50 PM","Created by  EMS from 10 Vancouver Island, Nanaimo","Updated by  EMS from 10 Vancouver Island, Nanaimo","8/28/1990",""
"E211209","GREENWOOD - STEWARDSON INLET (PE04878)","Outfall","OUTFALLOUTFALL","","","","49.420000","-126.3144","","1:50,000 scale map","","","4878","","","","","11/1/1996 10:49:00 AM","6/14/1999 2:25:50 PM","Created by  EMS from 10 Vancouver Island, Nanaimo","Updated by  EMS from 10 Vancouver Island, Nanaimo","8/28/1990",""
"E211210","HESQUIAHT SEWAGE OUTFALL - PE8008","Outfall","WET WELL OUTFALL","","","","49.361100","-126.2511","","1:50,000 scale map","","","8008","","","","","11/1/1996 10:49:00 AM","6/14/1999 2:25:50 PM","Created by  EMS from 10 Vancouver Island, Nanaimo","Updated by  EMS from 10 Vancouver Island, Nanaimo","8/28/1990",""
"E211212","VELOSO - COMOX - PE 1931","Outfall","EFFLUENT DISCHARGEEFFLUENT DISCHARGE","","","","49.678300","-124.9683","","Geographic Positioning System (Datum not known)","","","1931","","","","","11/1/1996 10:49:00 AM","6/14/1999 2:25:50 PM","Created by  EMS from 10 Vancouver Island, Nanaimo","Updated by  EMS from 10 Vancouver Island, Nanaimo","8/28/1990",""
"E211213","LAZO BEACH - COMOX - PE2625","Outfall","EFFLUENT DISCHARGEEFFLUENT DISCHARGE Comments:   LOT PCLA, PLAN 15338N, DISTRICT LOT 191, LAND DISTRICT 15 COMOX BOUNDED ON S.W. BY PLAN 108R, ON N.W. BY RADFORD ROAD, ON N.E. BY PLAN 8452, AND ON S.E. BY HUTTON ROAD","","","","49.686700","-124.8797","","1:50,000 scale map","","","2625","","","","","11/1/1996 10:49:00 AM","6/14/1999 2:26:56 PM","Created by  EMS from 10 Vancouver Island, Nanaimo","Updated by  EMS from 10 Vancouver Island, Nanaimo","8/28/1990",""
"E211215","J.S.MCMILLAN - BAMFIELD - PE3140","Outfall","EFFLUENT DISCHARGE Comments:   BLOCK A, PLAN 997-0-S, FRACTIONAL S.W.1/4, SECTION 20, TOWNSHIP 1, BARCLAY DISTRICT","","","","48.831400","-125.1317","","Geographic Positioning System (Datum not known)","","","3140","","","","","11/1/1996 10:49:00 AM","6/14/1999 2:27:02 PM","Created by  EMS from 10 Vancouver Island, Nanaimo","Updated by  EMS from 10 Vancouver Island, Nanaimo","8/28/1990",""
"E211251","PG WOOD PRESERVING (PA05375) BURNER","Stack","WOODWASTE BURNERWOODWASTE BURNER Comments: burner phased out in accordance with the Wood Residue Burner and Incinerator reg.  A hogger and bins were installed.","","","","53.812800","-122.7261","","1:50,000 scale map","","","5375","","","","10/31/1996","11/1/1996 10:49:01 AM","3/29/1997 2:09:48 PM","Created by  EMS from 70 Omineca-Peace, Prince George","Updated by JENNIFER MCGUIRE from 70 Omineca-Peace, Prince George","8/28/1990",""
"E211252","PG WOOD 1 GAS FIRED LUMBER DRY KILN","Stack","1 GAS FIRED LUMBER DRY KILN","","","","53.812800","-122.7261","","1:50,000 scale map","","","5375","","","","","11/1/1996 10:49:01 AM","4/26/2005 2:36:59 PM","Created by  EMS from 70 Omineca-Peace, Prince George","Updated by Chris Raymond from 70 Omineca-Peace, Prince George","8/28/1990",""
"E211253","PG WOOD PRESERVING (PA05375) CYCLONE","Stack","SHAVINGS CYCLONESHAVINGS CYCLONE","","","","53.812800","-122.7261","","1:50,000 scale map","","","5375","","","","4/13/2000","11/1/1996 10:49:01 AM","9/25/2000 3:44:03 PM","Created by  EMS from 70 Omineca-Peace, Prince George","Updated by MAUREEN BILAWCHUK from 70 Omineca-Peace, Prince George","8/28/1990",""
"E211257","PR04133- EFFLUENT TREATMENT SLUDGE","Landfill","SLUDGE DISPOSAL SITE","","","","55.345600","-123.1825","","1:50,000 scale map","","","4133","","","","","11/1/1996 10:49:01 AM","3/2/2000 4:07:34 PM","Created by  EMS from 70 Omineca-Peace, Prince George","Updated by MAUREEN BILAWCHUK from 70 Omineca-Peace, Prince George","8/28/1990",""
"E211259","FFI PULP (PR04133) METAL","Landfill","METAL DISPOSAL SITE","","","","55.345600","-123.1825","","1:50,000 scale map","","","4133","","","","9/1/1999","11/1/1996 10:49:01 AM","9/1/1999 2:48:05 PM","Created by  EMS from 70 Omineca-Peace, Prince George","Updated by MAUREEN BILAWCHUK from 70 Omineca-Peace, Prince George","8/28/1990",""
"E211292","LANDFILL ABOVE DOCKS (PR00506)","Landfill","LEACHATE STREAM AT DOCKLEACHATE STREAM AT DOCK","","","","48.870800","-123.6472","","1:50,000 scale map","","","506","","","","","11/1/1996 10:49:04 AM","6/14/1999 2:25:52 PM","Created by  EMS from 10 Vancouver Island, Nanaimo","Updated by  EMS from 10 Vancouver Island, Nanaimo","8/29/1990",""
"E211298","DUNCAN SORT YARD LANDFILL (PR03882)","Landfill","VAUX SWAMPVAUX SWAMP Comments:   PORTION 300 FT X 400 FT LOCATED 600 FT SOUTH FROM NE CORNER SEC. 5 RANGE 10 SAHTLAM DIST","","","","48.754200","-123.7825","","Geographic Positioning System (Datum not known)","","","3882","","","","","11/1/1996 10:49:05 AM","6/14/1999 2:26:56 PM","Created by  EMS from 10 Vancouver Island, Nanaimo","Updated by  EMS from 10 Vancouver Island, Nanaimo","8/29/1990",""
"E211304","LANDFILL AT WATER PLANT (PR07399)","Landfill"," Comments: landfill and leachate collection system. Leachate collection and conveyance on or before Oct.31, 1994.","","","","48.871700","-123.6808","","1:50,000 scale map","","","7399","","","","","11/1/1996 10:49:05 AM","6/14/1999 2:25:52 PM","Created by  EMS from 10 Vancouver Island, Nanaimo","Updated by  EMS from 10 Vancouver Island, Nanaimo","8/29/1990",""
"E211305","HORSESHOE BAY REFUSE SITE (PR07267)","Landfill","","","","","48.913100","-123.7064","","1:50,000 scale map","","","7267","","","","","11/1/1996 10:49:05 AM","6/14/1999 2:25:53 PM","Created by  EMS from 10 Vancouver Island, Nanaimo","Updated by  EMS from 10 Vancouver Island, Nanaimo","8/29/1990",""
"E211308","MCCLIMON`S LANDFILL (PR05379)","Landfill","LEACHATE PONDLEACHATE POND","","","","48.395000","-123.6908","","1:50,000 scale map","","","5379","","","","","11/1/1996 10:49:05 AM","6/14/1999 2:25:53 PM","Created by  EMS from 10 Vancouver Island, Nanaimo","Updated by  EMS from 10 Vancouver Island, Nanaimo","8/29/1990",""
"E211322","SIMARD PIT (PE-08121)","Lake or Pond","","","","","48.666100","-123.6194","","1:50,000 scale map","","","8121","","","","","11/1/1996 10:49:06 AM","6/14/1999 2:25:53 PM","Created by  EMS from 10 Vancouver Island, Nanaimo","Updated by  EMS from 10 Vancouver Island, Nanaimo","8/29/1990",""
"E211333","HAMMERMILL (PA03822)","Stack","","","","","48.760800","-123.6892","","1:50,000 scale map","","","3822","","","","","11/1/1996 10:49:07 AM","6/14/1999 2:25:54 PM","Created by  EMS from 10 Vancouver Island, Nanaimo","Updated by  EMS from 10 Vancouver Island, Nanaimo","8/30/1990",""
"E211357","STORAGE TANKS (PA06244)","Stack","","","","","48.695300","-123.5453","","1:50,000 scale map","","","6244","","","","","11/1/1996 10:49:08 AM","6/14/1999 2:25:54 PM","Created by  EMS from 10 Vancouver Island, Nanaimo","Updated by  EMS from 10 Vancouver Island, Nanaimo","8/30/1990",""
"E211359","HAYLOCK BROTHERS ASPHALT PLANT (PA06471)","Stack","ASPHALT PLANT STACK","","","","49.306900","-124.355","","Geographic Positioning System (Datum not known)","","","6471","","","","","11/1/1996 10:49:08 AM","10/29/1997 3:54:30 PM","Created by  EMS from 10 Vancouver Island, Nanaimo","Updated by BERNIE TAEKEMA from 10 Vancouver Island, Nanaimo","8/30/1990",""
"E211361","HAYLOCK BROTHERS ASPHALT HEATER (PA06471)","Stack","","","","","49.307000","-124.355","","Geographic Positioning System (Datum not known)","","","6471","","","","","11/1/1996 10:49:08 AM","10/29/1997 3:55:45 PM","Created by  EMS from 10 Vancouver Island, Nanaimo","Updated by BERNIE TAEKEMA from 10 Vancouver Island, Nanaimo","8/30/1990",""
"E211362","DREDGATE LANDFILL (PR06300)","Landfill","LEACHATE STREAMLEACHATE STREAM","","","","48.968900","-125.5625","","Geographic Positioning System (Datum not known)","","","6300","","","","","11/1/1996 10:49:08 AM","6/14/1999 2:25:54 PM","Created by  EMS from 10 Vancouver Island, Nanaimo","Updated by  EMS from 10 Vancouver Island, Nanaimo","8/30/1990",""
"E211369","ALBERNI FOUNDRY (PA05701)","Stack"," Comments:   COMPANY IS LOOKING FOR NEW LOCATION","","","","49.259200","-124.7606","","1:50,000 scale map","","","5701","","","","","11/1/1996 10:49:08 AM","6/14/1999 2:25:54 PM","Created by  EMS from 10 Vancouver Island, Nanaimo","Updated by  EMS from 10 Vancouver Island, Nanaimo","8/30/1990",""
"E211393","BURNER PA02684","Stack","","","","","54.500000","-124.3","","1:20,000 scale map (NAD83)","","","2684","","","","","11/1/1996 10:49:09 AM","5/16/2005 1:26:31 PM","Created by  EMS from 70 Omineca-Peace, Prince George","Updated by Barb Beyer from 70 Omineca-Peace, Prince George","8/30/1990",""
"E211400","LAKEVIEW HOMES PARK (PE295) - EXFILTRATION LAGOON","Lake or Pond","STAFF GUAGE IN EXFILTRATION LAGOONSTAFF GUAGE IN EXFILTRATION LAGOON","","","","54.045000","-124.8817","","GOAT- 1:20,000 TRIM (NAD83)","","","295","","","","","11/1/1996 10:49:10 AM","12/23/1997 1:42:33 PM","Created by  EMS from 70 Omineca-Peace, Prince George","Updated by Ben Van Nostrand from 70 Omineca-Peace, Prince George","8/30/1990",""
"E211401","LAKEVIEW HOMES PARK (PE295) - RAW INFLOW","In-Plant","INFLOW TO TREATMENT SYSTEMINFLOW TO TREATMENT SYSTEM","","","","54.045000","-124.8817","","GOAT- 1:20,000 TRIM (NAD83)","","","295","","","","","11/1/1996 10:49:10 AM","12/23/1997 1:43:28 PM","Created by  EMS from 70 Omineca-Peace, Prince George","Updated by Ben Van Nostrand from 70 Omineca-Peace, Prince George","8/30/1990",""
"E211404","STONY CR PE5884 LAGOON OUTFALL","Outfall","OUTFALL TO STONY CREEKOUTFALL TO STONY CREEK","","","","53.943600","-124.1003","","1:50,000 scale map","","","5884","","","","","11/1/1996 10:49:10 AM","5/6/1999 1:34:26 PM","Created by  EMS from 70 Omineca-Peace, Prince George","Updated by Nadine Dubois from 70 Omineca-Peace, Prince George","8/30/1990",""
"E211405","STONY CR PE5884 RAW INFLOW","In-Plant","INFLOW OF RAW EFFLUENT TO STABILIZATION LAGOON.INFLOW OF RAW EFFLUENT TO STABILIZATION LAGOON.","","","","53.943600","-124.1003","","1:50,000 scale map","","","5884","","","","","11/1/1996 10:49:10 AM","5/6/1999 1:33:36 PM","Created by  EMS from 70 Omineca-Peace, Prince George","Updated by Nadine Dubois from 70 Omineca-Peace, Prince George","8/30/1990",""
"E211440","TARNOWSKI - UNION BAY - PE7455","Outfall","EFFLUENT DISCHARGEEFFLUENT DISCHARGE","","","","49.570600","-124.8731","","1:50,000 scale map","","","7455","","","","","11/1/1996 10:49:12 AM","6/14/1999 2:25:55 PM","Created by  EMS from 10 Vancouver Island, Nanaimo","Updated by  EMS from 10 Vancouver Island, Nanaimo","10/15/1992",""
