"location_id","name","type","comment","country","state","county","latitude","longitude","horizontal_datum","horizontal_collection_method","vertical_datum","vertical_collection_method","location_groups","elevation","elevation_unit","standards","ea_closed_date","ea_ems_when_created","ea_ems_when_updated","ea_ems_who_created","ea_ems_who_updated","ea_established_date","ea_well_tag_id"
"E221398","EVANS FOREST PRODUCTS (PA-2662) CHIPPER FINES CYCLONE","Stack","Comments: Legal Description:  that part of the North 1/2 of NE 1/4 of Sec. 14, TP 27, Range 22 W5M which lies west of a line parallel to and 50 ft. distant from the boundary of the R/W of CPR as shown on Plan 633-B, Kootenay District.","","","","51.3128","-116.9819","","GOAT- 1:20,000 TRIM (NAD83)","","","2662","","","",NA,1996-11-01 10:54:30,1999-04-26 13:29:39,"Created by  EMS from 41 Kootenay, Cranbrook","Updated by William (Hugh) Auld from 41 Kootenay, Cranbrook",1994-12-07,""
"E221412","SAWMILL CHIPPER CYCLONE","Stack","","","","","53.1736","-122.3444","","1:50,000 scale map","","","3898","","","",1996-12-05,1996-11-01 10:54:31,1996-12-16 14:43:00,"Created by  EMS from 70 Omineca-Peace, Prince George","Updated by JENNIFER MCGUIRE from 70 Omineca-Peace, Prince George",1994-12-14,""
"E221416","PR-11606 SMELT/ASH FROM EFFLUENT INCINERATOR","Landfill","","","","","55.7421","-122.3026","","Geographic Positioning System (Datum not known)","","","11606","","","",NA,1996-11-01 10:54:31,1997-01-30 13:25:13,"Created by  EMS from 70 Omineca-Peace, Prince George","Updated by Cameron Eggleston from 70 Omineca-Peace, Prince George",1994-12-16,""
"E221420","QUINTRELL(PE12599) - EFFLUENT","Outfall","TREATMENT PLANT EFFLUENT","","","","50.0517","-125.225","","Geographic Positioning System (Datum not known)","","","12599","","","",NA,1996-11-01 10:54:31,1999-06-14 14:26:45,"Created by  EMS from 10 Vancouver Island, Nanaimo","Updated by  EMS from 10 Vancouver Island, Nanaimo",1994-12-22,""
"E221425","PA-12682: EMERGENCY FLARE STACK","Stack","","","","","57","-121.5","","1:20,000 scale map (NAD27)","","","12862","","","",NA,1996-11-01 10:54:31,2005-05-25 09:47:50,"Created by  EMS from 70 Omineca-Peace, Prince George","Updated by Steve Jenvey from 70 Omineca-Peace, Prince George",1994-12-28,""
"E221426","PA-12682:AMINE REBOILER UNIT","Stack","","","","","57","-121.5","","1:20,000 scale map (NAD27)","","","12862","","","",NA,1996-11-01 10:54:31,2005-05-25 09:48:36,"Created by  EMS from 70 Omineca-Peace, Prince George","Updated by Steve Jenvey from 70 Omineca-Peace, Prince George",1994-12-28,""
"E221427","PA-12682:SALES GAS DEHYDRATION REBOILER UNIT","Stack","","","","","57","-121.5","","1:20,000 scale map (NAD27)","","","12862","","","",NA,1996-11-01 10:54:31,2005-05-25 09:49:33,"Created by  EMS from 70 Omineca-Peace, Prince George","Updated by Steve Jenvey from 70 Omineca-Peace, Prince George",1994-12-28,""
"E221428","PA-12862:FUEL GAS DEHYDRATION REBOILER UNIT","Stack","","","","","57","-121.5","","1:20,000 scale map (NAD27)","","","12862","","","",NA,1996-11-01 10:54:31,2005-05-25 09:50:17,"Created by  EMS from 70 Omineca-Peace, Prince George","Updated by Steve Jenvey from 70 Omineca-Peace, Prince George",1994-12-28,""
"E221429","PA12862:ACID GAS INCINERATOR STACK","Stack","","","","","57","-121.5","","1:20,000 scale map (NAD27)","","","12862","","","",NA,1996-11-01 10:54:31,2005-05-25 09:50:52,"Created by  EMS from 70 Omineca-Peace, Prince George","Updated by Steve Jenvey from 70 Omineca-Peace, Prince George",1994-12-28,""
"E221430","PA-12862:SALES GAS COMPRESSOR DRIVE UNIT","Stack","","","","","57","-121.5","","1:20,000 scale map (NAD27)","","","12862","","","",NA,1996-11-01 10:54:31,2005-05-25 09:51:36,"Created by  EMS from 70 Omineca-Peace, Prince George","Updated by Steve Jenvey from 70 Omineca-Peace, Prince George",1994-12-28,""
"E221432","PA-12862:TWO ELECTRIC GENERATOR DRIVE UNITS","Stack","","","","","57","-121.5","","1:20,000 scale map (NAD27)","","","12862","","","",NA,1996-11-01 10:54:32,2005-05-25 09:52:43,"Created by  EMS from 70 Omineca-Peace, Prince George","Updated by Steve Jenvey from 70 Omineca-Peace, Prince George",1994-12-28,""
"E221433","PA-12862:HEAT TRACING MEDIUM BOILER UNIT","Stack","","","","","57","-121.5","","1:20,000 scale map (NAD27)","","","12862","","","",NA,1996-11-01 10:54:32,2005-05-25 09:53:18,"Created by  EMS from 70 Omineca-Peace, Prince George","Updated by Steve Jenvey from 70 Omineca-Peace, Prince George",1994-12-28,""
"E221434","PA-12862: FWKO HEATER UNIT","Stack","","","","","57","-121.5","","1:20,000 scale map (NAD27)","","","12862","","","",NA,1996-11-01 10:54:32,2005-05-25 09:53:54,"Created by  EMS from 70 Omineca-Peace, Prince George","Updated by Steve Jenvey from 70 Omineca-Peace, Prince George",1994-12-28,""
"E221435","PA-12862:GROUP TREATER HEATER UNIT","Stack","","","","","57","-121.5","","1:20,000 scale map (NAD27)","","","12862","","","",NA,1996-11-01 10:54:32,2005-05-25 09:54:26,"Created by  EMS from 70 Omineca-Peace, Prince George","Updated by Steve Jenvey from 70 Omineca-Peace, Prince George",1994-12-28,""
"E221436","PA-12862: TEST TREATER HEATER UNIT","Stack","","","","","57","-121.5","","1:20,000 scale map (NAD27)","","","12862","","","",NA,1996-11-01 10:54:32,2005-05-25 09:54:56,"Created by  EMS from 70 Omineca-Peace, Prince George","Updated by Steve Jenvey from 70 Omineca-Peace, Prince George",1994-12-28,""
"E221438","PA-12862:PIG RECEIVER","Stack","","","","","57","-121.5","","1:20,000 scale map (NAD27)","","","12862","","","",NA,1996-11-01 10:54:32,2005-05-25 09:55:28,"Created by  EMS from 70 Omineca-Peace, Prince George","Updated by Steve Jenvey from 70 Omineca-Peace, Prince George",1994-12-28,""
"E221456","PE-12849 STRANAN EFF PITT RIVER","Outfall","SEWAGE TREATMENT PLANT","","","","49.2654","-122.7073","","GOAT- orthoimagery (NAD83)","","","12849","","","",NA,1996-11-01 10:54:32,1998-03-11 18:57:04,"Created by  EMS from 20 Lower Mainland, Surrey","Updated by  EMS from 20 Lower Mainland, Surrey",1995-01-09,""
"E221457","OCEAN CONSTRUCTION OUTFALL RIVER ROAD CULVERT","Ditch or Culvert","OUTFALL OF RIVER ROAD CULVERT ON SOUTH SIDE OF RIVER ROAD","","","","49.1281","-123.0493","","GOAT- orthoimagery (NAD83)","","","2273","","","",NA,1996-11-01 10:54:32,1998-03-11 18:57:04,"Created by  EMS from 20 Lower Mainland, Surrey","Updated by  EMS from 20 Lower Mainland, Surrey",1995-04-18,""
"E221458","RIVER ROAD DITCH 50 METRES UPSTREAM; WEST (PE 02273)","Ditch or Culvert","RIVER ROAD DITCH 50 METRES UPSTREAM FROM INFILTRATION PIT","","","","49.1276","-123.0497","","GOAT- orthoimagery (NAD83)","","","2273","","","",NA,1996-11-01 10:54:32,2005-04-28 16:34:37,"Created by  EMS from 20 Lower Mainland, Surrey","Updated by Liz Freyman from 20 Lower Mainland, Surrey",1995-04-18,""
"E221476","INDIVIDUAL SEPTIC TANKS AND TILE FIELDS","Tile Field","no sampling required by permit, septic tank discharge","","","","49.2475","-119.8275","","1:50,000 scale map","","","13256","","","",NA,1996-11-01 10:54:33,2001-07-17 08:58:59,"Created by  EMS from 80 Southern Region, Penticton","Updated by  EMS from 80 Southern Region, Penticton",1995-01-17,""
"E221500","ALCAN CELL A: SPECIAL WASTE CELL","Storage","ALCAN: Wharf dredgate cell (2000 m3). Contains PAH exceeding Special Waste 1000ppm (TEQ). KCP Laydown area.","","","","54.0062","-128.7022","","1:50,000 scale map","","","13517","","","",NA,1996-11-01 10:54:34,1999-04-16 11:21:38,"Created by  EMS from 60 Skeena","Updated by   from 60 Skeena",1995-01-24,""
"E221513","U/S OF DECHORINATION POND","In-Plant","U/S dechorination pond Comments: The sample point is U/S of the dechorination pond (ie. within the treatment works)","","","","55.0567","-126.5123","","GOAT- 1:20,000 TRIM (NAD83)","","","8841","","","",NA,1996-11-01 10:54:34,1997-12-15 12:54:35,"Created by  EMS from 60 Skeena","Updated by   from 60 Skeena",1995-01-31,""
"E221521","PRECISION CYCLONE PA13272","Stack","discharge","","","","49.1557","-121.9928","","GOAT- orthoimagery (NAD83)","","","13278","","","",NA,1996-11-01 10:54:34,1998-03-11 18:57:21,"Created by  EMS from 20 Lower Mainland, Surrey","Updated by  EMS from 20 Lower Mainland, Surrey",1995-02-02,""
"E221534","PE-13344:OIL/WATER SEPARATOR","Ditch or Culvert","40 km north of FSJ on 101 Road","","","","56.644206","-120.812354","","1:20,000 scale map (NAD27)","","","13344","","","",NA,1996-11-01 10:54:35,2005-05-17 13:05:46,"Created by  EMS from 70 Omineca-Peace, Prince George","Updated by Steve Jenvey from 70 Omineca-Peace, Prince George",1995-02-09,""
"E221551","SALMON ARM GOLF CLUB (PE-13334) TILE FIELD","Tile Field","Dosing chamber prior to tile field Comments: North Half of North half, Section 5, Township 20, Range 9, except 14347, 18041 and 30873 of Plan 10964, Kamloops Division Yale District, West of the Sixth Meridian.//","","","","50.6942","-119.2422","","1:50,000 scale map","","","13334","","","",NA,1996-11-01 10:54:35,1998-02-06 09:52:08,"Created by  EMS from 30 Southern Region, Kamloops","Updated by Dean Jeske from 30 Southern Region, Kamloops",1995-02-16,""
"E221573","(PS-11635) STORAGE SITE","Storage","","","","","48.5386","-123.4594","","1:50,000 scale map","","","11635","","","",NA,1996-11-01 10:54:37,1999-06-14 14:27:02,"Created by  EMS from 10 Vancouver Island, Nanaimo","Updated by  EMS from 10 Vancouver Island, Nanaimo",1995-02-22,""
"E221606","QR GOLD (PA13658) REFINERY AND KILN EXHAUST","Stack","refinery dust collector and carbon regen. kiln exhaust fan","","","","52.6722","-121.7911","","Geographic Positioning System (Datum not known)","","","18124","","","",NA,1996-11-01 10:54:38,1996-12-05 14:51:20,"Created by  EMS from 50 Cariboo, Williams Lake","Updated by DOUGLAS HILL from 50 Cariboo, Williams Lake",1995-03-02,""
"E221607","QR GOLD (PA13658) ELECTROWINING CELLS EXHAUST","Stack","electrowinning cells fume exhaust and casutic and cyanide mixing/storage tank exhaust","","","","52.6722","-121.7911","","Geographic Positioning System (Datum not known)","","","18124","","","",NA,1996-11-01 10:54:38,1996-12-05 14:51:49,"Created by  EMS from 50 Cariboo, Williams Lake","Updated by DOUGLAS HILL from 50 Cariboo, Williams Lake",1995-03-02,""
"E221608","QR GOLD (PA13658) DIESEL GENERATORS","Stack","","","","","52.6722","-121.7911","","Geographic Positioning System (Datum not known)","","","18124","","","",NA,1996-11-01 10:54:38,1996-12-05 14:52:22,"Created by  EMS from 50 Cariboo, Williams Lake","Updated by DOUGLAS HILL from 50 Cariboo, Williams Lake",1995-03-02,""
"E221610","QR GOLD (PA13658) ACID WASH TANK","Stack","acid wash tank fume exhaust","","","","52.6722","-121.7908","","Geographic Positioning System (Datum not known)","","","18124","","","",NA,1996-11-01 10:54:38,1996-12-05 14:53:11,"Created by  EMS from 50 Cariboo, Williams Lake","Updated by DOUGLAS HILL from 50 Cariboo, Williams Lake",1995-03-02,""
"E221611","QR GOLD (PA13658) ORE CRUSHER","Stack","primary and secondary  ore crushers and ore conveyors","","","","52.6714","-121.7911","","Geographic Positioning System (Datum not known)","","","18124","","","",NA,1996-11-01 10:54:38,1996-12-05 15:38:24,"Created by  EMS from 50 Cariboo, Williams Lake","Updated by DOUGLAS HILL from 50 Cariboo, Williams Lake",1995-03-02,""
"E221612","QR GOLD (PA13658) ASSAY LAB","Stack","","","","","52.6719","-121.7908","","Geographic Positioning System (Datum not known)","","","18124","","","",NA,1996-11-01 10:54:38,1996-12-05 15:38:48,"Created by  EMS from 50 Cariboo, Williams Lake","Updated by DOUGLAS HILL from 50 Cariboo, Williams Lake",1995-03-21,""
"E221638","QR GOLD (PE12601) E9 POLISH. POND O/F TO PIT","In-Plant","polishing pond overflow to pit (permittee site E9)","","","","52.6758","-121.7911","","Geographic Positioning System (Datum not known)","","","12601","","","",NA,1996-11-01 10:54:39,1996-12-05 15:57:51,"Created by  EMS from 50 Cariboo, Williams Lake","Updated by DOUGLAS HILL from 50 Cariboo, Williams Lake",1995-03-15,""
"E221669","WALTER BURTNICK PE12947 SEWAGE OUTFALL","Outfall","after secondary sewage treatment","","","","49.628","-124.0386","","GOAT- 1:20,000 TRIM (NAD83)","","","12947","","","",NA,1996-11-01 10:54:40,1998-05-21 19:47:02,"Created by  EMS from 20 Lower Mainland, Surrey","Updated by  EMS from 20 Lower Mainland, Surrey",1995-03-21,""
"E221684","NORTHERN LITE MFT. - STACK","Stack","","","","","49.9147","-119.3962","","1:50,000 scale map","","","12775","","","",NA,1996-11-01 10:54:41,2001-07-17 08:59:09,"Created by  EMS from 80 Southern Region, Penticton","Updated by  EMS from 80 Southern Region, Penticton",1995-03-28,""
"E221685","PA-02119 MAGNESIUM SULPHATE REACTOR","Stack","STACK","","","","53.8406","-122.7311","","1:50,000 scale map","","","2119","","","",NA,1996-11-01 10:54:41,2003-12-17 16:32:48,"Created by  EMS from 70 Omineca-Peace, Prince George","Updated by MAUREEN BILAWCHUK from 70 Omineca-Peace, Prince George",1995-03-29,""
"E221686","PA-02119 MAGNESIUM OXIDE LOADING HOPPER","Stack","","","","","53.8406","-122.7311","","1:50,000 scale map","","","2119","","","",NA,1996-11-01 10:54:41,2003-12-17 16:33:42,"Created by  EMS from 70 Omineca-Peace, Prince George","Updated by MAUREEN BILAWCHUK from 70 Omineca-Peace, Prince George",1995-03-29,""
"E221693","ONE ELECTRICAL POWER GENERATOR DRIVE UNITS","Stack","","","","","55.2","-121.72","","1:50,000 scale map","","","8738","","","",NA,1996-11-01 10:54:41,2000-03-08 15:11:48,"Created by  EMS from 70 Omineca-Peace, Prince George","Updated by Cameron Eggleston from 70 Omineca-Peace, Prince George",1995-04-03,""
"E221697","RDNO; CHERRYVILLE LANDFILL OPEN BURN - WOODWASTE","Landfill","RDNO, CherryvilleLandfill, Open Burn, Woodwaste","","","","50.259","-118.6132","","1:50,000 scale map","","","15285","","","",NA,1996-11-01 10:54:41,2001-07-17 09:04:02,"Created by  EMS from 80 Southern Region, Penticton","Updated by  EMS from 80 Southern Region, Penticton",1995-04-05,""
"E221707","RDCK LANDFILL WELL C-MW-2; CRESTON","Well","","","","","49.0426","-116.5106","","Differential Geographic Positioning System (Datum not known)","","","16913","556","m","",NA,1996-11-01 10:54:42,1998-11-10 08:31:55,"Created by  EMS from 40 Kootenay, Nelson","Updated by HUGH AULD from 40 Kootenay, Nelson",1995-04-10,""
"E221711","PA-12765 HYLAND PRECAST CEMENT SILO","Stack","","","","","49.6397","-125.0117","","1:50,000 scale map","","","12765","","","",NA,1996-11-01 10:54:42,1999-06-14 14:26:46,"Created by  EMS from 10 Vancouver Island, Nanaimo","Updated by  EMS from 10 Vancouver Island, Nanaimo",1995-04-11,""
"E221723","PENTICTON FOUNDRY LTD. PA 7041 BAGHOUSE 2 SHELLCORE MACHINES","Stack","Baghouse #2 - shell core machines emission","","","","49.4758","-119.5686","","1:50,000 scale map","","","7041","","","",NA,1996-11-01 10:54:42,2005-03-21 16:11:09,"Created by  EMS from 80 Southern Region, Penticton","Updated by Mike Reiner from 80 Southern Region, Penticton",1995-04-18,""
"E221733","PA-8212:AMINE SUMP","Stack","stack","","","","56.826222","-122.361778","","1:20,000 scale map (NAD27)","","","8212","","","",NA,1996-11-01 10:54:43,2005-05-16 11:44:53,"Created by  EMS from 70 Omineca-Peace, Prince George","Updated by Steve Jenvey from 70 Omineca-Peace, Prince George",1995-04-20,""
"E221742","BC GAS (PA 13070) KITCHNER EXHAUST 1","Stack","Exhaust from Gas Turbine #1","","","","49.1641","-116.2818","","Differential Geographic Positioning System (Datum not known)","","","13070","747","m","",NA,1996-11-01 10:54:43,1998-06-11 15:17:58,"Created by  EMS from 41 Kootenay, Cranbrook","Updated by William (Hugh) Auld from 41 Kootenay, Cranbrook",1995-04-24,""
"E221743","BC GAS (PA 13070) KITCHNER EXHAUST 2","Stack","Exhaust from Gas Turbine #2","","","","49.1642","-116.2819","","Differential Geographic Positioning System (Datum not known)","","","13070","747","m","",NA,1996-11-01 10:54:43,1998-06-11 15:18:53,"Created by  EMS from 41 Kootenay, Cranbrook","Updated by William (Hugh) Auld from 41 Kootenay, Cranbrook",1995-04-24,""
"E221744","BC GAS (PA 13070) KITCHNER BLOWDOWN","Stack","Misc. Methane Vents","","","","49.1641","-116.2818","","Differential Geographic Positioning System (Datum not known)","","","13070","747","m","",NA,1996-11-01 10:54:43,1998-06-11 15:19:29,"Created by  EMS from 41 Kootenay, Cranbrook","Updated by William (Hugh) Auld from 41 Kootenay, Cranbrook",1995-04-24,""
"E221749","DISPOSAL FIELDS ARE ON SHERWOOD PARK PROPERTY","Tile Field","Comments: Discharge from 10 of the 11 lot subdivision discharges to the Sherwood Park property.  Lot 11 is a separate disposal system approved by Ministry of Health and therefore is a separate waste site.","","","","49.6179","-119.6755","","1:50,000 scale map","","","12803","","","",NA,1996-11-01 10:54:43,2001-07-17 09:01:25,"Created by  EMS from 80 Southern Region, Penticton","Updated by  EMS from 80 Southern Region, Penticton",1995-04-26,""
"E221782","THOMPSON-NICOLA REGIONAL DISTRICT (PE-13506) PAUL LAKE RBC - TILE FIELD","Tile Field","AFTER DISCHARGE FROM THE RBC AND BEFORE IT REACHES THE FIELDSIE) AT THE DOSING SYPHON AREA","","","","50.7343","-120.1627","","GOAT- 1:20,000 TRIM (NAD83)","","","13506","","","",NA,1996-11-01 10:54:44,1997-02-17 16:46:15,"Created by  EMS from 30 Southern Region, Kamloops","Updated by COLLEEN LAVIOLETTE from 30 Southern Region, Kamloops",1995-05-03,""
"E221783","PE-3190 TREE ISLAND SEPTIC DISCHARGE","Outfall","END OF PIPE DISCHARGING TO LAGOON","","","","49.1852","-122.9642","","GOAT- orthoimagery (NAD83)","","","3190","","","",NA,1996-11-01 10:54:44,1998-05-21 19:47:02,"Created by  EMS from 20 Lower Mainland, Surrey","Updated by  EMS from 20 Lower Mainland, Surrey",1995-05-03,""
"E221823","PA13640 TARGET PRODUCTS MATSQUI - AGGR DRYING","Stack","PA13640 TARGET PRODUCTS MATSQUI - SCRUBBER STACK","","","","49.0209","-122.422","","GOAT- orthoimagery (NAD83)","","","13640","","","",NA,1996-11-01 10:54:46,1998-04-16 14:52:10,"Created by  EMS from 20 Lower Mainland, Surrey","Updated by SUSAN WOODBINE from 20 Lower Mainland, Surrey",1995-05-10,""
"E221867","SCANLAND`S VACUUM TANKER LTD. (PS-12751) SPECIAL WASTE STORAGE","Storage","2101 THEATRE RD., CRANBROOK","","","","49.535","-115.7536","","GOAT- 1:20,000 TRIM (NAD83)","","","12751","","","",NA,1996-11-01 10:54:48,1999-11-05 08:35:22,"Created by  EMS from 41 Kootenay, Cranbrook","Updated by William (Hugh) Auld from 41 Kootenay, Cranbrook",1995-06-22,""
"E221869","BETHLEHEM RESOURCES (PR-6167) OPEN BURN","Open Burning","","","","","51.6324","-118.424","","GOAT- 1:20,000 TRIM (NAD83)","","","6167","","","",NA,1996-11-01 10:54:48,1998-12-22 11:08:36,"Created by  EMS from 40 Kootenay, Nelson","Updated by HUGH AULD from 40 Kootenay, Nelson",1995-07-25,""
"E221879","QUESNEL; P. SHECK (PA13326) PAINT BOOTH","Stack","","","","","53.0069","-122.5067","","GOAT- 1:20,000 TRIM (NAD83)","","","13326","","","",NA,1996-11-01 10:54:48,2005-05-11 09:52:59,"Created by  EMS from 50 Cariboo, Williams Lake","Updated by Roland Grimm from 50 Cariboo, Williams Lake",1995-06-05,""
"E221887","PE13418 TRANSMOUNTAIN SUMAS MTN TANK FARM; TO DITCH","Outfall","PE13418 TRANSMOUNTAIN SUMAS TANK FARM - CONTAINMENT AREA FOR TANK 102 - TO DITCH","","","","49.0766","-122.2035","","GOAT- orthoimagery (NAD83)","","","13418","","","",NA,1996-11-01 10:54:49,2005-04-12 15:11:55,"Created by  EMS from 20 Lower Mainland, Surrey","Updated by Dennis Barlow from 20 Lower Mainland, Surrey",1995-06-06,""
"E221888","PE13418 TRANSMOUNTAIN SUMAS TANK FARM","Outfall","PE13418 TRANSMOUNTAIN SUMAS TANK FARM - CONTAINMENT AREA FOR STORAGE TANK 103 - TO HURLEY CREEK","","","","49.0788","-122.2046","","GOAT- orthoimagery (NAD83)","","","13418","","","",NA,1996-11-01 10:54:49,1998-03-11 18:57:04,"Created by  EMS from 20 Lower Mainland, Surrey","Updated by  EMS from 20 Lower Mainland, Surrey",1995-06-06,""
"E221892","ADVENTURE PAVING (RA-13862) DRUM MIXER DRYER STACK","Stack","DRYER STACK","","","","54.02","-132.16","","1:50,000 scale map","","","105653","","","",NA,1996-11-01 10:54:49,1997-11-12 09:27:52,"Created by  EMS from 60 Skeena","Updated by JOHN COLLISON-BAKER from 60 Skeena",1995-06-09,""
"E221917","OWEN BAY RETREAT BUSBY ISLAND (PE13428)","Outfall","outfall","","","","50.3016","-125.2245","","GOAT- 1:20,000 TRIM (NAD83)","","","13428","","","",NA,1996-11-01 10:54:50,1998-07-29 14:47:45,"Created by  EMS from 10 Vancouver Island, Nanaimo","Updated by   from 10 Vancouver Island, Nanaimo",1995-06-15,""
"E221938","PR- 11606 SLUDGE APPLICATION TO LAND","Landfill","","","","","55.7421","-122.3026","","Geographic Positioning System (Datum not known)","","","11606","","","",NA,1996-11-01 10:54:51,1998-10-02 10:33:04,"Created by  EMS from 70 Omineca-Peace, Prince George","Updated by Cameron Eggleston from 70 Omineca-Peace, Prince George",1995-06-20,""
"E221943","P & T PR-01421 ASBESTOS SITE","Landfill","","","","","55.2944","-123.1639","","1:50,000 scale map","","","1421","","","",NA,1996-11-01 10:54:51,2002-02-08 11:06:12,"Created by  EMS from 70 Omineca-Peace, Prince George","Updated by MAUREEN BILAWCHUK from 70 Omineca-Peace, Prince George",1995-06-22,""
"E221996","ENVIROGREEN TECHNOLOGIES LTD.","Stack","exhaust stack of a thermal treatment facility","","","","49.3536","-120.5626","","1:50,000 scale map","","","13075","","","",NA,1996-11-01 10:54:53,2001-07-17 08:59:29,"Created by  EMS from 80 Southern Region, Penticton","Updated by  EMS from 80 Southern Region, Penticton",1995-07-11,""
"E222000","RDCK (PR-501) STABILIZED BIOSOLIDS STORAGE","Landfill","","","","","49.2608","-117.6339","","GOAT- 1:20,000 TRIM (NAD83)","","","17126","","","",NA,1996-11-01 10:54:53,1999-03-17 11:41:41,"Created by  EMS from 40 Kootenay, Nelson","Updated by HUGH AULD from 40 Kootenay, Nelson",1995-07-17,""
"E222001","RDCK (PR-501) UNSTABLE BIOSOLIDS DISPOSAL","In-Plant","","","","","49.2617","-117.6328","","GOAT- 1:20,000 TRIM (NAD83)","","","17126","","","",NA,1996-11-01 10:54:53,1999-03-17 11:42:42,"Created by  EMS from 40 Kootenay, Nelson","Updated by HUGH AULD from 40 Kootenay, Nelson",1995-07-17,""
"E222002","RV PARK DISPOSAL SITE","Tile Field","","","","","50.7169","-119.0375","","1:50,000 scale map","","","12600","","","",NA,1996-11-01 10:54:53,2001-07-17 09:01:58,"Created by  EMS from 80 Southern Region, Penticton","Updated by  EMS from 80 Southern Region, Penticton",1995-07-18,""
"E222003","SUNKATCHER RV PARK","Tile Field","","","","","49.2767","-120.0291","","1:50,000 scale map","","","13542","","","",NA,1996-11-01 10:54:53,2001-07-17 08:59:29,"Created by  EMS from 80 Southern Region, Penticton","Updated by  EMS from 80 Southern Region, Penticton",1995-07-18,""
"E222022","PE-00254 SLUDGE FROM MAGNESIUM SULPHATE PLANT","Land - Farm","sludge from the magnesium sulphate plant","","","","53.8406","-122.7311","","1:50,000 scale map","","","254","","","",NA,1996-11-01 10:54:54,2003-12-17 16:01:33,"Created by  EMS from 70 Omineca-Peace, Prince George","Updated by MAUREEN BILAWCHUK from 70 Omineca-Peace, Prince George",1995-09-28,""
"E222024","TREE ISLAND PE-3190 OVERFLOW TO WETLANDS","Seepage or Seepage Pools","","","","","49.1844","-122.965","","GOAT- orthoimagery (NAD83)","","","3190","","","",NA,1996-11-01 10:54:54,1998-05-21 19:47:02,"Created by  EMS from 20 Lower Mainland, Surrey","Updated by  EMS from 20 Lower Mainland, Surrey",1995-07-28,""
"E222026","SCHOOL DISTRICT NO.75 PE-12909 LAND DISPOSAL","Tile Field","FLOW MEASUREMENT DEVICE BEFORE DISPOSAL FIELDS","","","","49.1898","-122.0733","","GOAT- orthoimagery (NAD83)","","","12909","","","",NA,1996-11-01 10:54:54,1998-05-21 19:47:02,"Created by  EMS from 20 Lower Mainland, Surrey","Updated by  EMS from 20 Lower Mainland, Surrey",1995-07-31,""
"E222058","PR-03608 GROUNDWATER WELL","Well","centre of western edge of landfill site not installed as of 19970311","","","","54.0839","-128.611","","1:50,000 scale map","","","3608","","","",NA,1996-11-01 10:54:55,1997-03-11 11:49:21,"Created by  EMS from 60 Skeena","Updated by   from 60 Skeena",1995-08-10,""
"E222061","PR-03608 GROUNDWATER WELL BELOW REFUSE","Well","centre of the active disposal areanot installed as of 19970311","","","","54.0835","-128.6078","","1:50,000 scale map","","","3608","","","",NA,1996-11-01 10:54:55,1997-03-11 11:52:26,"Created by  EMS from 60 Skeena","Updated by   from 60 Skeena",1995-08-10,""
"E222080","ENGLEWOOD PACKING COMPANY LTD (PE13221)","Outfall","effluent","","","","50.5347","-126.875","","GOAT- 1:20,000 TRIM (NAD83)","","","13221","","","",NA,1996-11-01 10:54:56,1998-07-29 14:43:20,"Created by  EMS from 10 Vancouver Island, Nanaimo","Updated by   from 10 Vancouver Island, Nanaimo",1995-08-18,""
"E222093","100 MILE;CRD;(PR4994);TRENCH BURNER","Open Burning","","","","","51.6551","-121.3859","","Differential Geographic Positioning System (Datum not known)","","","4994","","","",NA,1996-11-01 10:54:56,1997-02-14 09:50:55,"Created by  EMS from 50 Cariboo, Williams Lake","Updated by DOUGLAS HILL from 50 Cariboo, Williams Lake",1995-08-24,""
"E222094","WHITE LAKE MOBILE VILLAS (PE-13682) TILEFIELDS","Tile Field","final discharge point prior to disposal field","","","","50.8844","-119.2947","","1:50,000 scale map","","","13682","","","",NA,1996-11-01 10:54:56,1998-03-02 10:03:20,"Created by  EMS from 30 Southern Region, Kamloops","Updated by COLLEEN LAVIOLETTE from 30 Southern Region, Kamloops",1995-08-24,""
"E222097","COLDSTREAM RANCH LANDFILL","Landfill","","","","","50.2174","-119.1722","","1:50,000 scale map","","","12821","","","",NA,1996-11-01 10:54:56,2001-07-17 08:59:32,"Created by  EMS from 80 Southern Region, Penticton","Updated by  EMS from 80 Southern Region, Penticton",1995-08-29,""
"E222098","GELCOAT; CHOPPER AND CURING OPERATIONS","Stack","","","","","50.4037","-119.2152","","1:50,000 scale map","","","13693","","","",NA,1996-11-01 10:54:57,2001-07-17 08:59:32,"Created by  EMS from 80 Southern Region, Penticton","Updated by  EMS from 80 Southern Region, Penticton",1995-08-29,""
