"location_id","name","type","comment","country","state","county","latitude","longitude","horizontal_datum","horizontal_collection_method","vertical_datum","vertical_collection_method","location_groups","elevation","elevation_unit","standards","ea_closed_date","ea_ems_when_created","ea_ems_when_updated","ea_ems_who_created","ea_ems_who_updated","ea_established_date","ea_well_tag_id"
"E229596","KELOWNA LANDFILL PR12218 MONITORING WELL 6-1","Well","City of Kelowna, Glenmore Landfill, GL 06-01","","","","49.9547","-119.4156","","GOAT- 1:20,000 TRIM (NAD83)","","","12218","","","",NA,1997-12-01 14:25:25,2001-07-17 09:03:45,"Created by Conrad Pryce from 80 Southern Region, Penticton","Updated by  EMS from 80 Southern Region, Penticton",1997-12-01,""
"E229597","KELOWNA LANDFILL PR12218 MONITORING WELL 7-1","Well","City of Kelowna, Glenmore Landfill, GL 07-01","","","","49.9547","-119.4156","","GOAT- 1:20,000 TRIM (NAD83)","","","12218","","","",NA,1997-12-01 14:27:42,2001-07-17 09:03:46,"Created by Conrad Pryce from 80 Southern Region, Penticton","Updated by  EMS from 80 Southern Region, Penticton",1997-12-01,""
"E229598","KELOWNA LANDFILL PR12218 MONITORING WELL 8-1","Well","City of Kelowna, Glenmore Landfill, GL 08-01","","","","49.9547","-119.4156","","GOAT- 1:20,000 TRIM (NAD83)","","","12218","","","",NA,1997-12-01 14:30:41,2001-07-17 09:03:46,"Created by Conrad Pryce from 80 Southern Region, Penticton","Updated by  EMS from 80 Southern Region, Penticton",1997-12-01,""
"E229599","KELOWNA LANDFILL PR12218 MONITORING WELL 8-2","Well","City of Kelowna, Glenmore Landfill, GL 08-02","","","","49.9547","-119.4156","","GOAT- 1:20,000 TRIM (NAD83)","","","12218","","","",NA,1997-12-01 14:33:15,2001-07-17 09:03:47,"Created by Conrad Pryce from 80 Southern Region, Penticton","Updated by  EMS from 80 Southern Region, Penticton",1997-12-01,""
"E229600","KELOWNA LANDFILL PR12218 MONITORING WELL 9-1","Well","City of Kelowna, Glenmore Landfill, GL 09-01","","","","49.9547","-119.4156","","GOAT- 1:20,000 TRIM (NAD83)","","","12218","","","",NA,1997-12-01 14:35:54,2001-07-17 09:03:47,"Created by Conrad Pryce from 80 Southern Region, Penticton","Updated by  EMS from 80 Southern Region, Penticton",1997-12-01,""
"E229601","KELOWNA LANDFILL PR12218 MONITORING WELL 9-2","Well","City of Kelowna, Glenmore Landfill, GL 09-02","","","","49.9547","-119.4156","","GOAT- 1:20,000 TRIM (NAD83)","","","12218","","","",NA,1997-12-01 14:38:01,2001-07-17 09:03:48,"Created by Conrad Pryce from 80 Southern Region, Penticton","Updated by  EMS from 80 Southern Region, Penticton",1997-12-01,""
"E229602","KELOWNA LANDFILL PR12218 MONITORING WELL 9-3","Well","City of Kelowna, Glenmore Landfill, GL 09-03","","","","49.9547","-119.4156","","GOAT- 1:20,000 TRIM (NAD83)","","","12218","","","",NA,1997-12-01 14:39:57,2001-07-17 09:03:48,"Created by Conrad Pryce from 80 Southern Region, Penticton","Updated by  EMS from 80 Southern Region, Penticton",1997-12-01,""
"E229603","KELOWNA LANDFILL PR12218 MONITORING WELL 10-1","Well","City of Kelowna, Glenmore Landfill, GL 10-01","","","","49.9547","-119.4156","","GOAT- 1:20,000 TRIM (NAD83)","","","12218","","","",NA,1997-12-01 14:42:05,2001-07-17 09:03:49,"Created by Conrad Pryce from 80 Southern Region, Penticton","Updated by  EMS from 80 Southern Region, Penticton",1997-12-01,""
"E229606","KELOWNA LANDFILL PR12218 BW1","Well","City of Kelowna, Glenmore Landfill, Background Well BW1","","","","49.9547","-119.4156","","GOAT- 1:20,000 TRIM (NAD83)","","","12218","","","",NA,1997-12-01 14:55:25,2001-07-17 09:03:50,"Created by Conrad Pryce from 80 Southern Region, Penticton","Updated by  EMS from 80 Southern Region, Penticton",1997-12-01,""
"E229607","KELOWNA LANDFILL PR12218 BW3","Well","City of Kelowna, Glenmore Landfill, Background Well BW3","","","","49.9547","-119.4156","","GOAT- 1:20,000 TRIM (NAD83)","","","12218","","","",NA,1997-12-01 14:57:28,2001-07-17 09:03:51,"Created by Conrad Pryce from 80 Southern Region, Penticton","Updated by  EMS from 80 Southern Region, Penticton",1997-12-01,""
"E229608","KELOWNA LANDFILL PR12218 SW2","Seepage or Seepage Pools","City of Kelowna, Glenmore Landfill, Compost Sump SW2","","","","49.9547","-119.4156","","GOAT- 1:20,000 TRIM (NAD83)","","","12218","","","",NA,1997-12-01 15:05:02,2001-07-17 09:07:05,"Created by Conrad Pryce from 80 Southern Region, Penticton","Updated by  EMS from 80 Southern Region, Penticton",1997-12-01,""
"E229657","PETRO-CANADA OIL AND GAS (PS-15216) - LAND TRT","Land - Farm","b-78-G/94-J-10 Landtreatment facility 20 km south of Ft Nelson","","","","58.64","-122.72","","Geographic Positioning System (Datum not known)","","","15216","","","",NA,1997-12-03 10:36:16,1997-12-03 10:42:27,"Created by IAN MITCHELL from 70 Omineca-Peace, Prince George","Updated by IAN MITCHELL from 70 Omineca-Peace, Prince George",1997-12-03,""
"E229658","RDKB GRAND FORKS LANDFILL MW1","Well","Regional District of Kootenay Boundary, Grand Forks Landfill, Monitoring Well 1","","","","49.0503","-118.4425","","GOAT- 1:20,000 TRIM (NAD83)","","","15290","","","",NA,1997-12-03 10:44:39,2001-07-17 09:03:52,"Created by Geri Huggins from 40 Kootenay, Nelson","Updated by  EMS from 40 Kootenay, Nelson",1997-12-03,""
"E229660","RDKB GRAND FORKS LANDFILL MW2","Well","Regional District of Kootenay Boundary, Grand Forks Landfill, Background Well 2","","","","49.0503","-118.4425","","GOAT- 1:20,000 TRIM (NAD83)","","","15290","","","",NA,1997-12-03 10:59:35,2001-07-17 09:03:52,"Created by Geri Huggins from 40 Kootenay, Nelson","Updated by  EMS from 40 Kootenay, Nelson",1997-12-03,""
"E229661","RDKB GRAND FORKS LANDFILL MW3","Well","Regional District of Kootenay Boundary, Grand Forks Landfill, Monitoring Well 3","","","","49.0503","-118.4425","","GOAT- 1:20,000 TRIM (NAD83)","","","15290","","","",NA,1997-12-03 11:03:46,2001-07-17 09:03:53,"Created by Geri Huggins from 40 Kootenay, Nelson","Updated by  EMS from 40 Kootenay, Nelson",1997-12-03,""
"E229674","RDKB GREENWOOD LANDFILL MW1","Well","Regional District of Kootenay Boundary, Greenwood Landfill Monitoring Well 1","","","","49.1003","-118.6917","","GOAT- 1:20,000 TRIM (NAD83)","","","15294","","","",NA,1997-12-03 13:29:56,2001-07-17 09:04:00,"Created by Geri Huggins from 40 Kootenay, Nelson","Updated by  EMS from 40 Kootenay, Nelson",1997-12-03,""
"E229675","RDKB GREENWOOD LANDFILL MW2","Well","Regional District of Kootenay Boundary, Greenwood Landfill Monitoring Well 2","","","","49.1003","-118.6917","","GOAT- 1:20,000 TRIM (NAD83)","","","15294","","","",NA,1997-12-03 13:31:44,2001-07-17 09:04:00,"Created by Geri Huggins from 40 Kootenay, Nelson","Updated by  EMS from 40 Kootenay, Nelson",1997-12-03,""
"E229676","RDKB GREENWOOD LANDFILL MW3","Well","Regional District of Kootenay Boundary, Greenwood Landfill Monitoring Well 3","","","","49.1003","-118.6917","","GOAT- 1:20,000 TRIM (NAD83)","","","15294","","","",NA,1997-12-03 13:33:29,2001-07-17 09:04:01,"Created by Geri Huggins from 40 Kootenay, Nelson","Updated by  EMS from 40 Kootenay, Nelson",1997-12-03,""
"E229764","KOOTENAY PUMPING SYSTEMS LTD.","Landfill","Domestic Sewage Drying Basins - 1.5 km South of Nicholson, B.C.","","","","51.22","-116.93","","1:50,000 scale map","","","15162","","","",NA,1997-12-08 09:53:52,1998-01-22 10:44:15,"Created by Dan Flegel from 41 Kootenay, Cranbrook","Updated by William (Hugh) Auld from 41 Kootenay, Cranbrook",1997-12-08,""
"E229853","RDNO; VERNON POTTERY ROAD LANDFILL MW1","Well","Monitoring Well 1","","","","50.2494","-119.2211","","GOAT- 1:20,000 TRIM (NAD83)","","","15289","","","",NA,1997-12-12 13:21:12,2001-07-17 09:04:05,"Created by Geri Huggins from 80 Southern Region, Penticton","Updated by  EMS from 80 Southern Region, Penticton",1997-12-12,""
"E229854","RDNO VERNON POTTERY RD LANDFILL PR 15289 MW2","Well","Monitoring Well 2","","","","50.2494","-119.2211","","GOAT- 1:20,000 TRIM (NAD83)","","","15289","","","",NA,1997-12-12 13:24:05,2001-07-17 09:04:06,"Created by Geri Huggins from 80 Southern Region, Penticton","Updated by  EMS from 80 Southern Region, Penticton",1997-12-12,""
"E229855","RDNO VERNON POTTERY RD LANDFILL PR 15289 MW3","Well","Monitoring Well 3","","","","50.2494","-119.2211","","GOAT- 1:20,000 TRIM (NAD83)","","","15289","","","",NA,1997-12-12 13:26:11,2001-07-17 09:04:06,"Created by Geri Huggins from 80 Southern Region, Penticton","Updated by  EMS from 80 Southern Region, Penticton",1997-12-12,""
"E229856","RDNO VERNON POTTERY RD LANDFILL PR15289 MW4","Well","Monitoring Well 4","","","","50.2494","-119.2211","","GOAT- 1:20,000 TRIM (NAD83)","","","15289","","","",NA,1997-12-12 13:28:16,2001-07-17 09:04:07,"Created by Geri Huggins from 80 Southern Region, Penticton","Updated by  EMS from 80 Southern Region, Penticton",1997-12-12,""
"E229857","RDNO VERNON POTTERY RD LANDFILL PR 15289 MW5","Well","Monitoring Well 5","","","","50.2494","-119.2211","","GOAT- 1:20,000 TRIM (NAD83)","","","15289","","","",NA,1997-12-12 13:32:57,2001-07-17 09:04:07,"Created by Geri Huggins from 80 Southern Region, Penticton","Updated by  EMS from 80 Southern Region, Penticton",1997-12-12,""
"E229858","RDNO VERNON POTTERY RD LANDFILL PR 15289 MW6","Well","Monitoring Well  6","","","","50.2494","-119.2211","","GOAT- 1:20,000 TRIM (NAD83)","","","15289","","","",NA,1997-12-12 13:34:43,2001-07-17 09:04:08,"Created by Geri Huggins from 80 Southern Region, Penticton","Updated by  EMS from 80 Southern Region, Penticton",1997-12-12,""
"E229859","RDNO VERNON POTTERY RD LANDFILL PR 15289 MW7","Well","Monitoring Well 7","","","","50.2494","-119.2211","","GOAT- 1:20,000 TRIM (NAD83)","","","15289","","","",NA,1997-12-12 13:36:45,2001-07-17 09:04:08,"Created by Geri Huggins from 80 Southern Region, Penticton","Updated by  EMS from 80 Southern Region, Penticton",1997-12-12,""
"E229862","RDNO VERNON POTTERY RD LANDFILL PR 15289 SW1","Spring or Hot Spring","Surface Water 1 Located  downgradient at the west landfill boundary in French Spring.","","","","50.2494","-119.2211","","GOAT- 1:20,000 TRIM (NAD83)","","","15289","","","",NA,1997-12-12 15:08:33,2001-07-17 09:04:09,"Created by Geri Huggins from 80 Southern Region, Penticton","Updated by  EMS from 80 Southern Region, Penticton",1997-12-12,""
"E229863","RDNO VERNON POTTERY RD LANDFILL PR 15289 SW2","Ditch or Culvert","Surface Water 2 Future Inlet structure.","","","","50.2494","-119.2211","","GOAT- 1:20,000 TRIM (NAD83)","","","15289","","","",NA,1997-12-12 15:11:53,2001-07-17 09:04:09,"Created by Geri Huggins from 80 Southern Region, Penticton","Updated by  EMS from 80 Southern Region, Penticton",1997-12-12,""
"E229947","HUSBY FB #3","Seepage or Seepage Pools","Colnett Point landfill","","","","53.942","-132.687","","1:20,000 scale map (Datum not known)","","","5773","","","",NA,1997-12-18 11:07:20,1997-12-18 11:08:23,"Created by   from 60 Skeena","Updated by   from 60 Skeena",1997-12-18,""
"E229998","CASTLEGAR GOLF CLUB (PE-14704) EFFLUENT DISCHARGE","Septic Tank","","","","","49.306","-117.6185","","GOAT- 1:20,000 TRIM (NAD83)","","","14704","","","",NA,1997-12-22 11:24:59,1998-10-15 15:33:32,"Created by HUGH AULD from 40 Kootenay, Nelson","Updated by HUGH AULD from 40 Kootenay, Nelson",1997-12-22,""
"E230017","98803117 BC LTD PE-14338 TREATED SEWAGE DISCHARGE","Tile Field","Discharge of tertiary effluent to land from a mobile home and rv park.","","","","49.1318","-122.5771","","GOAT- orthoimagery (NAD83)","","","14338","","","",NA,1997-12-31 11:11:05,1998-01-05 11:39:01,"Created by Sisto Bosa from 20 Lower Mainland, Surrey","Updated by Sisto Bosa from 20 Lower Mainland, Surrey",1997-12-31,""
"E230038","OSOYOOS; PE-86; WATER LEVEL OLD STORAGE RESERVOIR #1","Storage","Install a suitable staff gauge for measuring water level in the old winter storage reservoir #1","","","","49.0179","-119.4889","","1:50,000 scale map","","","12214","","","",NA,1998-01-05 09:30:32,2001-07-17 09:04:11,"Created by ROSE GUNOFF from 80 Southern Region, Penticton","Updated by  EMS from 80 Southern Region, Penticton",1998-01-05,""
"E230039","OSOYOOS; PE-86; WATER LEVEL NEW STORAGE RESERVOIR #2","Storage","Install a suitable staff gauge for measuring the water level in the new storage reservoir #2","","","","49.0208","-119.4871","","1:50,000 scale map","","","12214","","","",NA,1998-01-05 09:33:40,2001-07-17 09:04:12,"Created by ROSE GUNOFF from 80 Southern Region, Penticton","Updated by  EMS from 80 Southern Region, Penticton",1998-01-05,""
"E230043","WESTERN PULP PR-7322 OLD LANDFILL SITE","Landfill","Authorization to discharge only until June 30, 1992.","","","","49.67","-123.2554","","GOAT- orthoimagery (NAD83)","","","7322","","","",NA,1998-01-05 14:07:19,1998-04-08 09:02:38,"Created by   from 20 Lower Mainland, Surrey","Updated by SUSAN WOODBINE from 20 Lower Mainland, Surrey",1998-01-05,""
"E230140","GAMBRINOUS MALTING CORP. PA 11295  SPRAY IRRIGATION","Irrigation Spray/Sludge","","","","","50.4019","-119.2214","","GOAT- 1:20,000 TRIM (NAD83)","","","11295","","","",NA,1998-01-14 09:00:59,2001-07-17 09:04:15,"Created by DICK COLVEY from 80 Southern Region, Penticton","Updated by  EMS from 80 Southern Region, Penticton",1998-01-14,""
"E230141","GAMBRINOUS MALING CORP PA 11295  LOG DECK DISCHARGE","Irrigation Spray/Sludge","","","","","50.4019","-119.2214","","GOAT- 1:20,000 TRIM (NAD83)","","","11295","","","",NA,1998-01-14 09:06:32,2001-07-17 09:04:16,"Created by DICK COLVEY from 80 Southern Region, Penticton","Updated by  EMS from 80 Southern Region, Penticton",1998-01-14,""
"E230537","WICP; FINES SILO BAGHOUSE; PA 8631","Stack","Baghouse on fines silo","","","","50.6666","-120.3333","","1:50,000 scale map","","","8631","500","m","",NA,1998-02-09 09:34:54,1998-02-09 15:03:14,"Created by DAVID MARDON from 30 Southern Region, Kamloops","Updated by DAVID MARDON from 30 Southern Region, Kamloops",1998-02-09,""
"E230539","CITY OF KAMLOOPS (OC-3328) MISSION FLATS WELL 88-1","Well","Ground water monitoring well #88-1","","","","50.6904","-120.4527","","GOAT- 1:20,000 TRIM (NAD83)","","","3328","","","",NA,1998-02-09 10:40:59,1998-02-09 10:43:54,"Created by COLLEEN LAVIOLETTE from 30 Southern Region, Kamloops","Updated by COLLEEN LAVIOLETTE from 30 Southern Region, Kamloops",1998-02-09,""
"E230540","POPE & TALBOT LTD. (PE-5594) STORM WATER DISCHARGE","Outfall","","","","","49.3383","-117.7361","","GOAT- 1:20,000 TRIM (NAD83)","","","5594","","","",NA,1998-02-09 10:41:15,1999-03-16 15:37:15,"Created by HUGH AULD from 40 Kootenay, Nelson","Updated by HUGH AULD from 40 Kootenay, Nelson",1998-02-09,""
"E230547","CITY OF KAMLOOPS (OC-3328) MISSION FLATS BACKGROUND WELL","Well","Ground water back ground monitoring well","","","","50.6904","-120.4527","","GOAT- 1:20,000 TRIM (NAD83)","","","3328","4527","m","",NA,1998-02-09 10:50:20,1998-02-09 10:51:15,"Created by COLLEEN LAVIOLETTE from 30 Southern Region, Kamloops","Updated by COLLEEN LAVIOLETTE from 30 Southern Region, Kamloops",1998-02-09,""
"E230548","CITY OF KAMLOOPS (OC-3328) MISSION FLATS WELL BH1","Well","Ground water monitoring well BH1","","","","50.6904","-120.4527","","GOAT- 1:20,000 TRIM (NAD83)","","","3328","","","",NA,1998-02-09 10:51:59,1998-02-09 10:52:37,"Created by COLLEEN LAVIOLETTE from 30 Southern Region, Kamloops","Updated by COLLEEN LAVIOLETTE from 30 Southern Region, Kamloops",1998-02-09,""
"E230550","CITY OF KAMLOOPS (OC-3328) MISSION FLATS WELL BH2","Well","Ground water monitoring well BH2","","","","50.6904","-120.4527","","GOAT- 1:20,000 TRIM (NAD83)","","","3328","","","",NA,1998-02-09 10:53:18,1998-02-09 10:53:45,"Created by COLLEEN LAVIOLETTE from 30 Southern Region, Kamloops","Updated by COLLEEN LAVIOLETTE from 30 Southern Region, Kamloops",1998-02-09,""
"E230553","CITY OF KAMLOOPS (OC-3328) MISSION FLATS WELL BH5","Well","Ground water monitoring well BH5","","","","50.6904","-120.4527","","GOAT- 1:20,000 TRIM (NAD83)","","","3328","","","",NA,1998-02-09 10:57:04,1998-02-09 10:57:28,"Created by COLLEEN LAVIOLETTE from 30 Southern Region, Kamloops","Updated by COLLEEN LAVIOLETTE from 30 Southern Region, Kamloops",1998-02-09,""
"E230554","CITY OF KAMLOOPS (OC-3328) MISSION FLATS WELL BH6","Well","Ground water monitoring well BH6","","","","50.6904","-120.4527","","GOAT- 1:20,000 TRIM (NAD83)","","","3328","","","",NA,1998-02-09 10:58:03,1998-02-09 10:58:14,"Created by COLLEEN LAVIOLETTE from 30 Southern Region, Kamloops","Updated by COLLEEN LAVIOLETTE from 30 Southern Region, Kamloops",1998-02-09,""
"E230578","CANADIAN MOUNTAIN HOLIDAYS (PE-14917) REVELSTOKE EFFLUENT DISCHARGE","Infiltration Pond","","","","","51.6256","-118.3994","","GOAT- 1:20,000 TRIM (NAD83)","","","14917","","","",NA,1998-02-10 09:35:28,1999-03-18 10:41:04,"Created by HUGH AULD from 40 Kootenay, Nelson","Updated by HUGH AULD from 40 Kootenay, Nelson",1998-02-10,""
"E230657","VERNON STP; PE-12215; DELLCLIFF WATER UTILITY INTAKE","Air Quality","Dellcliff Water Utility Intake is a background sampling site for cryptosporidium monitoring.  Located on east side of Vernon Arm of Okanagan Lake.  Approx. 2,000 m north of Ellison Provincial Park.","","","","50.1921","-119.433","","GOAT- 1:20,000 TRIM (NAD83)","","","12215","","","",NA,1998-02-17 11:30:08,2001-07-17 09:04:20,"Created by ROSE GUNOFF from 80 Southern Region, Penticton","Updated by  EMS from 80 Southern Region, Penticton",1998-02-17,""
"E230817","PE 7129 MT BALDY STRATA  CORP TP11","Well","TP11 downgradient located west of the main Baldy rd to Rock Creek and about 400m SE of the intersection to Oliver on Crown Licence #401871.","","","","50.2357","-119.2221","","GOAT- 1:20,000 TRIM (NAD83)","","","7129","","","",NA,1998-02-24 13:50:13,2001-07-17 09:04:24,"Created by Geri Huggins from 80 Southern Region, Penticton","Updated by  EMS from 80 Southern Region, Penticton",1996-09-10,""
"E230818","PE 7129 MT BALDY STRATA CORP TP10","Well","TP10 downgradient located west of the main Baldy rd to Rock Creek and about 400m SE of the intersection to Oliver on Crown Licence #401871.","","","","50.2371","-119.0758","","GOAT- 1:20,000 TRIM (NAD83)","","","7129","","","",NA,1998-02-24 13:51:41,2001-07-17 09:04:25,"Created by Geri Huggins from 80 Southern Region, Penticton","Updated by  EMS from 80 Southern Region, Penticton",1996-09-10,""
"E230819","PE 7129 MT BALDY COM STRATA CORP BH2","Well","BH2 backgroundwell located west of the main Baldy rd to Rock Creek and about 400m SE of the intersection to Oliver on Crown Licence #401871.","","","","50.2369","-119.2197","","GOAT- 1:20,000 TRIM (NAD83)","","","7129","","","",NA,1998-02-24 13:54:16,2001-07-17 09:04:25,"Created by Geri Huggins from 80 Southern Region, Penticton","Updated by  EMS from 80 Southern Region, Penticton",1996-09-10,""
"E230820","PE 7129 MT BALDY COM STRATA CORP BH3","Well","BH3 backgroundwell located west of the main Baldy rd to Rock Creek and about 400m SE of the intersection to Oliver on Crown Licence #401871.","","","","50.2468","-119.2225","","GOAT- 1:20,000 TRIM (NAD83)","","","7129","","","",NA,1998-02-24 13:55:41,2001-07-17 09:04:26,"Created by Geri Huggins from 80 Southern Region, Penticton","Updated by  EMS from 80 Southern Region, Penticton",1996-09-10,""
"E230904","CAPITAL REGIONAL DISTRICT; ME-15445","Outfall","Saanich Peninsula Unified Treatment Plant","","","","48.6212","-123.4064","","1:50,000 scale map","","","15445","","","",NA,1998-02-26 10:32:20,1998-02-26 10:32:56,"Created by   from 10 Vancouver Island, Nanaimo","Updated by   from 10 Vancouver Island, Nanaimo",1998-02-26,""
"E231005","MAIN ZONE DIVERSION DITCH HUCKLEBERRY PE-14483","Ditch or Culvert","1997 & 1998 flows to the east to either connector dam or SC-4. In later years when moved upslope it might drain to the west.","","","","53.675","-127.19","","GOAT- 1:20,000 TRIM (NAD83)","","","14483","","","",NA,1998-03-06 13:19:55,1998-10-15 13:51:03,"Created by   from 60 Skeena","Updated by   from 60 Skeena",1997-05-16,""
"E231158","HALCYON HOT SPRINGS (PE-15495) RESORT DEVELOPMENT","Tile Field","","","","","50.5133","-117.8971","","Geographic Positioning System (Datum not known)","","","15495","596","m","",NA,1998-03-17 10:31:54,1998-11-10 16:01:49,"Created by HUGH AULD from 40 Kootenay, Nelson","Updated by HUGH AULD from 40 Kootenay, Nelson",1998-03-17,""
"E231635","DEL BURNS BOG PR1611 DITCH #47","Ditch or Culvert","LEACHATE MONITORING STATION #47 LOCATED EAST OF LEACHATE DITCH, MIDWAY BETWEEN NORTH AND SOUTH DITCHES.","","","","49.0988","-122.9885","","GOAT- 1:20,000 TRIM (NAD83)","","","1611","","","",NA,1998-04-17 09:02:03,1998-04-21 10:14:28,"Created by SUSAN WOODBINE from 20 Lower Mainland, Surrey","Updated by SUSAN WOODBINE from 20 Lower Mainland, Surrey",1998-04-17,""
"E231638","DEL BURNS BOG PR1611 DITCH #44","Ditch or Culvert","SURFACE WATER LOCATION #44 LOCATED IN DRAINAGE DITCH NORTH OF THE ACTIVE FILL AREA","","","","49.1025","-122.984","","GOAT- 1:20,000 TRIM (NAD83)","","","1611","","","",NA,1998-04-17 09:08:39,1998-04-21 10:15:04,"Created by SUSAN WOODBINE from 20 Lower Mainland, Surrey","Updated by SUSAN WOODBINE from 20 Lower Mainland, Surrey",1998-04-17,""
"E231639","DEL BURNS BOG PR1611 DITCH #45","Ditch or Culvert","SURFACE WATER LOCATION #45 LOCATED IN DRAINAGE DITCH SOUTH OF THE ACTIVE FILL AREA","","","","49.0955","-122.9841","","GOAT- 1:20,000 TRIM (NAD83)","","","1611","","","",NA,1998-04-17 09:09:57,1998-04-21 10:15:16,"Created by SUSAN WOODBINE from 20 Lower Mainland, Surrey","Updated by SUSAN WOODBINE from 20 Lower Mainland, Surrey",1998-04-17,""
"E231640","DEL BURNS BOG PR1611 DITCH #48","Ditch or Culvert","SURFACE WATER STATION #48 LOCATED EAST OF DRAINAGE DITCH, MIDWAY BETWEEN NORTH AND SOUTH DITCHES","","","","49.0987","-122.9843","","GOAT- 1:20,000 TRIM (NAD83)","","","1611","","","",NA,1998-04-17 09:11:49,1998-04-21 10:15:33,"Created by SUSAN WOODBINE from 20 Lower Mainland, Surrey","Updated by SUSAN WOODBINE from 20 Lower Mainland, Surrey",1998-04-17,""
"E231759","SKEENA CELLULOSE INC. TERRACE LUMBER OPERATIONS(PR-04712) W. KALUM LANDFILL","Landfill","Wood waste landfill on the west side of the Kitsumkalum River, located about 7 km north of Terrace.  Access via the Highway 16 West bridge over the Kitsumkalum River, going past Bell Pole and turn right.","","","","54.579","-128.677","","1:50,000 scale map","","","4712","210","m","",NA,1998-04-23 13:51:58,1998-04-24 11:23:18,"Created by Hoa Le from 60 Skeena","Updated by   from 60 Skeena",1998-04-23,""
"E231769","CORD WESTBANK (PE-11562) OKANAGAN LK SITE DIRECTLY ABOVE DIFFUSER","Lake or Pond","Okanagan Lake monitoring site directly above the Westbank STP outfall diffuser in approximately +40 metres of water and 400 metres offshore south of the pumphouse at the end of Whitworth Rd.","","","","49.8052","-119.6388","","1:50,000 scale map","","","11652","","","",NA,1998-04-24 16:03:58,2001-07-17 09:04:29,"Created by ROSE GUNOFF from 80 Southern Region, Penticton","Updated by  EMS from 80 Southern Region, Penticton",1998-04-24,""
"E231770","CORD WESTBANK (PE-11652) BACKGROUND OKANAGAN LAKE SITE","Lake or Pond","This site is located halfway between the outfall diffuser site (E231769) and Drought Creek, in the same depth of water as the diffuser (40+metres), and approximately the same distance from shore, if possible.","","","","49.7998","-119.6581","","1:50,000 scale map","","","11652","","","",NA,1998-04-24 16:10:45,2001-07-17 09:04:30,"Created by ROSE GUNOFF from 80 Southern Region, Penticton","Updated by  EMS from 80 Southern Region, Penticton",1998-04-24,""
"E231777","RENTAL DRINKING WATER WELL","Well","ARMSTRONG SPALLUMCHEEN LANDFILL","","","","50.4469","-119.1678","","GOAT- 1:20,000 TRIM (NAD83)","","","15284","","","",NA,1998-04-27 12:00:15,2001-07-17 09:04:30,"Created by Geri Huggins from 80 Southern Region, Penticton","Updated by  EMS from 80 Southern Region, Penticton",1997-11-28,""
"E231819","CORD WESTBANK STP (PE-11652) EFFLUENT IRRIGATION","Irrigation Spray/Sludge","This EMS site is for monitoring the effluent irrigation.","","","","49.8109","-119.6352","","1:50,000 scale map","","","11652","","","",NA,1998-04-28 15:43:51,2001-07-17 09:04:31,"Created by ROSE GUNOFF from 80 Southern Region, Penticton","Updated by  EMS from 80 Southern Region, Penticton",1998-04-28,""
"E231857","GEORGE SURGENOR (MR-8834) DEMOLITON DEBRIS DISPOSAL","Landfill","Landfill","","","","49.45","-125","","1:50,000 scale map","","","8834","20","m","",NA,1998-04-29 14:36:33,2004-11-19 12:06:00,"Created by  LEUSCHE from 10 Vancouver Island, Nanaimo","Updated by JOHN COLLISON-BAKER from 10 Vancouver Island, Nanaimo",1998-04-29,""
"E231887","THORNHILL SW-12","River, Stream, or Creek","wetland near where leachate flow from SW-9 & SW-21 enters wetland","","","","54.4961","-128.4898","","GOAT- 1:20,000 TRIM (NAD83)","","","4057","","","",NA,1998-05-01 15:40:46,1998-05-14 16:06:05,"Created by   from 60 Skeena","Updated by   from 60 Skeena",1998-05-01,""
"E232085","CONSTRUCTION AGGR. (PR-15188) BIOSOLIDS TO GROUND","Landfill","Primary & secondary sludge from Howe Sound Pulp & Paper Ltd. and sanitary sludges from Gibson, Sechelt and/or Lions Gate.  Note - part of this area was previously covered under AR-14857.","","","","49.4833","-123.7417","","1:50,000 scale map","","","15188","","","",NA,1998-05-20 11:29:52,1998-05-20 11:36:24,"Created by SUSAN WOODBINE from 20 Lower Mainland, Surrey","Updated by SUSAN WOODBINE from 20 Lower Mainland, Surrey",1998-05-20,""
"E232122","15-INJECTION WELL @ NEWALTA; PE-14924","Well","15-05-83-17 W6M","","","","56.1739","-120.6433","","Geographic Positioning System (Datum not known)","","","14924","","","",NA,1998-05-25 16:28:15,1998-05-26 08:49:40,"Created by Ben Van Nostrand from 70 Omineca-Peace, Prince George","Updated by Ben Van Nostrand from 70 Omineca-Peace, Prince George",1998-05-25,""
